Title,Price,Capacity,Country,Unit,Characteristics,Quantity,Type,ABV,Vintage
Moët & Chandon 'Grand Vintage' 2013/15 Champagne,69.99,75.0,France,9.4,"Walnut, Biscuit, Hazelnut, Nectarine, Pastry, Peach, Pear",per bottle,White,12.5,2015
"Boekenhoutskloof Cabernet Sauvignon 2017/20, Stellenbosch",44.99,75.0,South Africa,10.9,"Vanilla, Blackcurrant, Earth, Leather, Smoke",per bottle,Red,14.5,2020
Ciabot Berton Barolo DOCG 2017/18,32.99,75.0,Italy,10.9,"Spice, Earth, Leather, Red Fruit, Rose",per bottle,Red,14.5,2018
Pommery 'Brut Rosé Royal’ Champagne,51.99,75.0,France,9.4,"Strawberry, Raspberry, Red Cherry",per bottle,Rosé,12.5,Non-Vintage
"Rupert & Rothschild Baron Edmond 2017/18, Western Cape",37.99,75.0,South Africa,10.5,"Black Fruit, Black Plum, Tobacco, Vanilla",per bottle,Red,14.0,2018
"Pouilly-Fumé de Ladoucette 2021/22, France",37.99,75.0,France,10.1,"Smoke, Citrus Fruit, Grass, Green Apple",per bottle,White,13.5,2021
"Nyetimber 'Classic Cuvée' Brut Half Bottle, Sussex",19.99,37.5,England,4.5,"Peach, Biscuit, Bread, Citrus Fruit, Green Apple",per bottle,White,12.0,Non-Vintage
"Nyetimber 'Classic Cuvée' Brut Magnum, Sussex",74.99,1.5,England,18.0,"Biscuit, Bread, Citrus Fruit, Green Apple, Peach",per bottle,White,12.0,Non-Vintage
Domaine Trouillet ‘Aux Chailloux’ Pouilly-Fuissé Premier Cru 2020,42.99,75.0,France,10.1,"Almond, Citrus Fruit, Floral, Lemon",per bottle,White,13.5,2020
Ruinart 'Second Skin' Blanc de Blancs Champagne,94.99,75.0,France,9.4,"Apricot, Lemon, Pastry",per bottle,White,12.5,Non-Vintage
"Nivola Lambrusco, Italy",14.99,75.0,Italy,7.9,"Violet, Red Cherry, Red Fruit",per bottle,Red,10.5,Non-Vintage
Cattier 'Millesime 2012' Premier Cru Brut Champagne,59.99,75.0,France,9.4,"Apricot, Peach, Red Fruit",per bottle,White,12.5,2012
Bollinger Special Cuvée Champagne Half Bottle,29.99,37.5,France,4.5,"Citrus Fruit, Biscuit, Bread",per bottle,White,12.0,Non-Vintage
"Emma Marris Sauvignon Blanc 2023, Marlborough",11.99,75.0,New Zealand,9.8,"Tropical Fruit, Gooseberry, Grass, Green Apple, Lemon",per bottle,White,13.0,2023
M. Chapoutier 'Belleruche' Côtes du Rhône 2021/22,12.99,75.0,France,10.9,"Spice, Black Plum, Blackberry, Earth, Raspberry",per bottle,Red,14.5,2022
"The Ned Pinot Grigio 2022/23, Marlborough",11.49,75.0,New Zealand,10.5,"Pear Drop, Blossom, Green Fruit, Nectarine",per bottle,White,14.0,2023
Château de Pizay Morgon 2021/22,15.99,75.0,France,10.5,"Vanilla, Blackberry, Raspberry, Red Cherry",per bottle,Red,14.0,2021
"Contesa Pecorino 2021/22, Colline Pescaresi",9.99,75.0,Italy,9.8,"Lemon, Blossom, Citrus Fruit, Green Apple",per bottle,White,13.0,2022
"Château Caronne Ste-Gemme 2016/18, Haut-Médoc",18.99,75.0,France,10.1,"Tobacco, Black Fruit, Blackcurrant, Cedar, Earth, Smoke",per bottle,Red,13.5,2018
Viña Alarde Rioja Reserva 2016/18,11.99,75.0,Spain,10.1,"Vanilla, Black Fruit, Red Fruit",per bottle,Red,13.5,2018
"Nunzio Ghiraldi Lugana DOC 2021/22, Italy",16.99,75.0,Italy,10.5,"Stone Fruit, Citrus Fruit, Floral",per bottle,White,14.0,2022
Beronia Rioja Crianza 2019/20,13.99,75.0,Spain,10.5,"Black Fruit, Red Fruit, Vanilla",per bottle,Red,14.0,2020
"Managers' Choice: VIK 'A' Cabernet Sauvignon 2020/21, Cachapoal Valley",19.99,75.0,Chile,10.5,"Green Bell Pepper, Black Cherry, Black Plum, Blackcurrant, Cedar",per bottle,Red,14.0,2021
"Framingham 'Nobody's Hero' Sauvignon Blanc 2020/22, Marlborough",14.99,75.0,New Zealand,10.1,"Tropical Fruit, Gooseberry, Grass, Green Apple, Lemon",per bottle,White,13.5,2022
Definition Chianti Classico DOCG 2019/20,11.99,75.0,Italy,9.8,"Red Fruit, Earth, Red Cherry",per bottle,Red,13.0,2020
"Penfolds 'Max's' Shiraz-Cabernet Sauvignon 2018/19, Australia",22.99,75.0,Australia,10.9,"Vanilla, Black Plum, Blackberry, Blackcurrant, Blueberry, Chocolate, Sweet Spice, Tobacco",per bottle,Red,14.5,2019
Château de La Tour de l'Ange Saint-Véran 2021/22,22.99,75.0,France,9.8,"Almond, Peach, Pear",per bottle,White,13.0,2022
"Château Tour Bayard 2019/20, Montagne-Saint-Émilion",17.99,75.0,France,11.3,"Sweet Spice, Blackcurrant, Liquorice",per bottle,Red,15.0,2020
"Mendel Selection Malbec 2018/20, Mendoza",22.99,75.0,Argentina,10.9,"Violet, Black Fruit, Red Fruit, Ripe Fruit, Spice, Vanilla",per bottle,Red,14.5,2020
"Cecchi ‘Governo All’uso Toscano’ 2020/21, Chianti DOCG",11.99,75.0,Italy,9.8,"Sweet Spice, Black Cherry, Red Fruit",per bottle,Red,13.0,2020
Domini Veneti Soave Classico DOC 2021/22,11.99,75.0,Italy,9.4,"Blossom, Citrus Fruit, Pineapple, Tropical Fruit",per bottle,White,12.5,2022
"Primitivo 'Il Feudo' 2021/22, Puglia",8.99,75.0,Italy,9.8,"Dried Herbs, Red Fruit, Spice",per bottle,Red,13.0,2022
Castello Banfi Rosso di Montalcino DOC 2019/20,19.99,75.0,Italy,10.9,"Strawberry, Raspberry, Red Cherry, Spice",per bottle,Red,14.5,2020
"Domodo Negroamaro 2021/22, Puglia",9.99,75.0,Italy,9.0,"Sweet Spice, Blackberry, Blackcurrant",per bottle,Red,12.0,2022
"Vasse Felix 'Filius' Cabernet-Merlot 2020/21, Margaret River",14.99,75.0,Australia,10.9,"Vanilla, Black Plum, Blackberry, Blackcurrant, Leather, Spice, Sweet Spice",per bottle,Red,14.5,2021
"Naudin Père et Fils Chardonnay 2021/22, France",11.99,75.0,France,10.1,"Lemon, Mango, Peach",per bottle,White,13.5,2022
"Oliver Dubois Muscadet 2020/22, Loire",9.99,75.0,France,9.0,"Pear, Green Apple, Lemon, Lime",per bottle,White,12.0,2022
"Caves d'Esclans 'The Beach by Whispering Angel' 2021/22, Côteaux d'Aix-en-Provence",18.99,75.0,France,9.8,"Peach, Raspberry, Strawberry",per bottle,Rosé,13.0,2022
"Corallo Nero d’Avola Organic 2020/21, Sicily",8.99,75.0,Italy,10.1,"Black Pepper, Red Fruit, Spice",per bottle,Red,13.5,2021
"Naudin Père et Fils Pinot Noir 2022, France",11.99,75.0,France,9.8,"Black Fruit, Floral, Red Fruit",per bottle,Red,13.0,2022
Selvapiana Chianti Rufina Riserva DOCG 2018/20,19.99,75.0,Italy,10.5,"Strawberry, Raspberry, Red Cherry, Spice",per bottle,Red,14.0,2018
Paul Jaboulet Aîné 'Parallèle 45' Organic Côtes du Rhône 2020/21,13.99,75.0,France,10.5,"White Pepper, Black Plum, Blackberry, Earth, Raspberry, Spice",per bottle,Red,14.0,2020
"Domaine du Vaux St Georges Sauvignon Blanc 2021/22, Touraine",13.99,75.0,France,10.1,"Green Apple, Citrus Fruit, Grass",per bottle,White,13.5,2022
"Baron Edmond de Rothschild 'Rimapere' Sauvignon Blanc 2022, Marlborough",19.99,75.0,New Zealand,9.8,"Tropical Fruit, Grass, Green Apple, Lemon",per bottle,White,13.0,2022
Domaine Olivier Foucher Menetou-Salon 2021/22,17.99,75.0,France,10.5,"Green Apple, Citrus Fruit, Grass",per bottle,White,14.0,2022
Domaine Moillard-Thomas Santenay Rouge 2018/19,27.99,75.0,France,10.5,"Raspberry, Red Cherry, Vanilla",per bottle,Red,14.0,2019
Domaine de Villemajou Organic Corbières Boutenac Rouge 2020/21,19.99,75.0,France,11.3,"Spice, Black Plum, Blackberry, Dried Herbs",per bottle,Red,15.0,2021
"Definition Riesling Kabinett 2021/22, Mosel",13.99,75.0,Germany,6.0,"Apricot, Citrus Fruit, Lychee",per bottle,White,8.0,2022
"Petaluma ‘White Label’ Cabernet Sauvignon 2017/19, Coonawarra",19.99,75.0,Australia,10.5,"Blackcurrant, Earth, Spice, Redcurrant, Cassis",per bottle,Red,14.0,2019
"Adega de Pegões ‘Selected Harvest’ White 2021/22, Portugal",11.99,75.0,Portugal,9.8,"Stone Fruit, Citrus Fruit, Cream, Floral",per bottle,White,13.0,2021
"Villa Maria 'Cellar Selection' Albariño 2020/21, Gisborne",14.99,75.0,New Zealand,10.1,"Wet Stones, Green Fruit, Lemon",per bottle,White,13.5,2021
"Marea Syrah 2020/21, Leyda Valley",15.99,75.0,Chile,10.9,"Violet, Blackberry, Blackcurrant",per bottle,Red,14.5,2021
"LFE 900 Single-Vineyard 2016/17, Colchagua Valley",16.99,75.0,Chile,10.9,"Violet, Black Cherry, Black Fruit, Blackberry, Blackcurrant, Chocolate, Coffee, Raspberry",per bottle,Red,14.5,2017
"Grant Burge 'Fifth Generation' Shiraz 2018, Barossa",16.99,75.0,Australia,10.9,"Black Plum, Blackberry, Blueberry, Chocolate, Cloves",per bottle,Red,14.5,2018
"Kanonkop 'Kadette' Pinotage 2019/20, Stellenbosch",15.99,75.0,South Africa,10.9,"Coffee, Black Cherry, Black Plum, Blackberry, Blackcurrant",per bottle,Red,14.5,2020
"Definition Chardonnay 2021/22, Limoux",13.99,75.0,France,10.1,"Vanilla, Apricot, Green Apple, Lemon, Peach",per bottle,White,13.5,2022
"Louis Latour 'Domaine de Valmoissine' Pinot Noir 2020/21, Var",16.99,75.0,France,10.1,"Vanilla, Black Cherry, Dried Herbs, Strawberry",per bottle,Red,13.5,2021
"Jim Barry 'Cover Drive' Cabernet Sauvignon 2019/20, Australia",15.99,75.0,Australia,10.5,"Tobacco, Black Cherry, Black Fruit, Black Plum, Blackberry, Blackcurrant, Blueberry, Cedar, Eucalyptus",per bottle,Red,14.0,2020
"Abbotts & Delaunay ‘Les Fruits Sauvages’ Malbec 2020/21, Languedoc",11.99,75.0,France,9.8,"Black Fruit, Red Fruit, Spice",per bottle,Red,13.0,2020
"Pringle Bay Chenin Blanc 2022, Western Cape",9.99,75.0,South Africa,9.8,"Citrus Fruit, Lemon, Red Apple",per bottle,White,13.0,2022
"Château Grimont 'Cuvée Prestige' 2017/18, Cadillac Côtes de Bordeaux",13.99,75.0,France,10.9,"Cedar, Black Plum, Blackcurrant",per bottle,Red,14.5,2018
"La Baume 'Cuvée Florence' Piquepoul Sauvignon Blanc 2021/22, Languedoc",9.99,75.0,France,9.4,"Wet Stones, Green Fruit, Herbaceous",per bottle,White,12.5,2022
Definition Barolo DOCG 2017/18,24.99,75.0,Italy,10.9,"Violet, Herbaceous, Red Fruit",per bottle,Red,14.5,2018
"Behind Closed Doors Reserva Red 2018/19, Lisbon",10.99,75.0,Portugal,10.9,"Vanilla, Black Plum, Blueberry",per bottle,Red,14.5,2019
"La Belle Angèle Pinot Noir 2020/21, France",9.99,75.0,France,9.8,"Strawberry, Black Cherry, Dried Herbs, Spice",per bottle,Red,13.0,2021
Porta 6 Vinho Verde 2021/22,8.99,75.0,Portugal,7.1,"Pear, Citrus Fruit, Green Apple",per bottle,White,9.5,2022
"Marqués de Riscal Verdejo 2021/22, Rueda",13.99,75.0,Spain,9.8,"Lime, Fennel, Green Apple",per bottle,White,13.0,2022
Famille Perrin Ventoux 2021/22,9.99,75.0,France,10.5,"Cinnamon, Red Fruit, Spice, Strawberry",per bottle,Red,14.0,2022
"Terrazas de los Andes Malbec 2020/21, Mendoza",18.99,75.0,Argentina,10.5,"Violet, Black Fruit, Chocolate, Red Fruit, Ripe Fruit, Tobacco",per bottle,Red,14.0,2020
"Definition Grüner Veltliner 2020/21, Austria",11.99,75.0,Austria,9.4,"White Pepper, Peach, Quince",per bottle,White,12.5,2021
"Robert Oatley 'Signature Series' Chardonnay 2021/22, Margaret River",14.99,75.0,Australia,9.8,"Butter, Cream, Lemon, Peach, Vanilla",per bottle,White,13.1,2022
"Santa Rita '120' Merlot 2021/22, Central Valley",8.99,75.0,Chile,10.1,"Ripe Fruit, Black Fruit, Red Fruit",per bottle,Red,13.5,2022
"Winzer Krems 'Orange' Grüner Veltliner 2020/21, Austria",11.99,75.0,Austria,9.8,"Stone Fruit, Citrus Fruit, Ginger",per bottle,Orange,13.0,2021
"Yalumba Y Series Tempranillo 2020/21, Australia",10.99,75.0,Australia,10.5,"Spice, Black Plum, Blackberry, Dried Herbs, Liquorice, Red Cherry, Smoke, Sour Cherry",per bottle,Red,14.0,2021
Pavillon La Tourelle Bordeaux Supérieur 2019,9.99,75.0,France,10.1,"Black Cherry, Black Fruit, Liquorice, Spice",per bottle,Red,13.5,2019
"Creation Chardonnay 2021/22, Walker Bay",15.99,75.0,South Africa,10.5,"Vanilla, Cream, Stone Fruit",per bottle,White,14.0,2022
"Carpe Diem Feteasca Alba 2021/22, Moldova",14.99,750.0,Moldova,9.8,"Blossom, Citrus Fruit, Grass, Green Apple",per bottle,White,13.0,2021
Domaine André et Edmond Figeat ‘Melody’ Pouilly-Fumé 2021/22,17.99,75.0,France,10.9,"Citrus Fruit, Peach, Smoke",per bottle,White,14.5,2022
"Domäne Wachau 'Weingärten Weissenkirchen' Grüner Veltliner Smaragd 2021/22, Wachau",17.99,75.0,Austria,10.1,"Stone Fruit, Citrus Fruit, Ripe Fruit",per bottle,White,13.5,2022
"Santa Rita '120' Carménère, Central Valley",8.99,75.0,Chile,10.1,"Vanilla, Black Plum, Blackberry, Blackcurrant, Chocolate, Raspberry, Tobacco",per bottle,Red,13.5,2021
"Santa Rita '120' Sauvignon Blanc 2021/22, Central Valley",8.99,75.0,Chile,10.1,"Green Apple, Citrus Fruit, Grass",per bottle,White,13.5,2022
"Yalumba Y Series Sauvignon Blanc 2021/22, Australia",10.99,75.0,Australia,10.1,"Tropical Fruit, Citrus Fruit, Gooseberry, Grapefruit, Grass, Lemon, Lime, Peach",per bottle,White,13.5,2022
Château Bel Air Bergerac Rouge 2020,9.99,75.0,France,10.9,"Black Fruit, Red Fruit, Vanilla",per bottle,Red,14.5,2020
"Von Der Land Zweigelt 2021/22, Austria",11.99,75.0,Austria,10.1,"Violet, Black Fruit, Red Fruit",per bottle,Red,13.5,2022
"Smith & Wright Shiraz 2020/21, Australia",7.99,75.0,Australia,10.1,"Vanilla, Black Pepper, Raspberry, Red Cherry, Red Fruit",per bottle,Red,13.5,2021
"Emiliana 'Elemental' Organic Gran Reserva Viognier 2021/22, Casablanca Valley",12.99,75.0,Chile,10.9,"Peach, Apricot, Floral, Honey",per bottle,White,14.5,2022
"Nero Oro Grillo Appassimento 2021/22, Sicily",11.99,75.0,Italy,10.1,"Tropical Fruit, Apricot, Honey, Peach",per bottle,White,13.5,2022
"Tutiac 'Lion & The Lily' Sauvignon Blanc 2021, Bordeaux",15.99,75.0,France,9.4,"Citrus Fruit, Gooseberry, Green Apple",per bottle,White,12.5,2021
"Iona ‘The Good Stuff White’, Cape South Coast",11.99,75.0,South Africa,9.4,"Apricot, Lemon, Peach",per bottle,White,12.5,2022
"Perdeberg Wines The Dry Land Collection ‘Rossouw’s Heritage’, Paarl",15.99,75.0,South Africa,10.1,"Citrus Fruit, Pear, Tropical Fruit",per bottle,White,13.5,2020
Marqués de Altillo Rioja 2021,10.99,75.0,Spain,9.8,"Black Fruit, Red Fruit, Vanilla",per bottle,Red,13.0,2021
"Viñalba 'Reserve' Malbec-Touriga Nacional 2020/21, Mendoza",12.99,75.0,Argentina,10.9,"Violet, Black Fruit, Red Fruit, Ripe Fruit, Vanilla",per bottle,Red,14.5,2020/21
Georges Duboeuf Morgon 2020,16.99,75.0,France,10.1,"Black Cherry, Black Fruit, Black Pepper, Spice",per bottle,Red,13.5,2020
Masi 'Campofiorin' Rosso Veronese 2018/19,15.99,75.0,Italy,9.8,"Vanilla, Red Cherry, Sweet Spice",per bottle,Red,13.0,2019
"Two Hands 'Gnarly Dudes' Shiraz 2021/22, Barossa Valley",21.99,75.0,Australia,10.8,"Vanilla, Black Pepper, Black Plum, Blackberry, Blackcurrant, Blueberry, Cedar, Chocolate, Tobacco",per bottle,Red,14.4,2022
"Cave Vinicole de Hunawihr Kuhlmann-Platz 'Cuvée Prestige' Pinot Gris 2020/21, Alsace",13.99,75.0,France,10.1,"Peach, Butter, Nectarine",per bottle,White,13.5,2021
Moillard-Thomas Coteaux Bourguignons 2021,11.99,75.0,France,9.4,"Blackcurrant, Red Cherry, Spice",per bottle,Red,12.5,2021
"Thymiopoulos ‘White’ Xinomavro-Malagousia 2021, Greece",14.99,75.0,Greece,9.0,"Citrus Fruit, Floral, Peach",per bottle,White,12.0,2021
Lulu 'l'Alouette Organic Chinon 2020/21,13.49,75.0,France,10.1,"Strawberry, Earth, Green Bell Pepper, Raspberry",per bottle,Red,13.5,2021
Plum & Pepper Barossa Shiraz 2017,14.99,75.0,Australia,10.9,"Black Pepper, Black Plum, Blackberry, Blackcurrant, Chocolate, Jammy",per bottle,Red,14.5,2017
"Château Livran 2014, Médoc",14.99,75.0,France,9.8,"Spice, Blackberry, Blackcurrant",per bottle,Red,13.0,2014
Viña Alarde Rioja Gran Reserva 2013/15,13.99,75.0,Spain,10.1,"Vanilla, Black Fruit, Red Fruit",per bottle,Red,13.5,2015
"Viña Albali Cabernet Tempranillo 0.5% 2021/22, Spain",4.99,75.0,Spain,0.4,"Black Cherry, Black Plum, Spice",per bottle,Red,0.5,2022
"Viña Albali Sauvignon Blanc 0.5% 2021/22, Spain",4.99,75.0,Spain,0.4,"Lemon, Lime, Tropical Fruit",per bottle,White,0.5,2022
"Alturo Malbec 2022/23, Mendoza",12.99,75.0,Argentina,10.1,"Violet, Black Fruit, Red Fruit, Ripe Fruit",per bottle,Red,13.5,2023
"Domaines Barons de Rothschild Lafite 'Réserve Spéciale' 2019/20, Médoc",24.99,75.0,France,10.1,"Leather, Ripe Fruit, Spice",per bottle,Red,13.5,2019
Taylor's LBV Port Decanter 2017/18 50cl,13.99,500.0,Portugal,10.0,"Cedar, Cigar Box, Jammy",per bottle,Red,20.0,2018
Croft Reserve Tawny Port,16.99,75.0,Portugal,15.0,"Nutmeg, Almond, Cinnamon",per bottle,Tawny,20.0,Non-Vintage
Bodegas Olarra 'Dehesa de Lantana' Rioja Gran Reserva 2015,15.99,75.0,Spain,10.5,"Vanilla, Black Fruit, Red Fruit",per bottle,Red,14.0,2015
Taylor's 'Quinta de Vargellas' 2013/15 Port,36.99,75.0,Portugal,15.4,"Prune, Date, Jammy",per bottle,Red,20.5,2013
"Saladini Pilastri Organic Pecorino 2021/22, Offida DOCG",12.99,75.0,Italy,10.1,"Stone Fruit, Citrus Fruit, Floral",per bottle,White,13.5,2022
"Royal Tokaji 5 Puttonyos 2016/17, Hungary 50cl",29.99,50.0,Hungary,5.8,"Peach, Apricot, Dried Fruit, Fig, Orange Marmalade",per bottle,White,11.5,2017
"Bodegas Caro 'Malbec Argentino' 2021, Mendoza",19.99,75.0,Argentina,10.9,"Black Fruit, Red Fruit, Ripe Fruit, Violet",per bottle,Red,14.5,2021
"Château Meyney 'La Chapelle de Meyney' 2016/17, Saint-Estèphe",26.99,75.0,France,10.1,"Cedar, Black Plum, Blackcurrant",per bottle,Red,13.5,2017
Parcel Series Saint-Estèphe 2020,29.99,75.0,France,9.8,"Blackcurrant, Red Cherry, Spice",per bottle,Red,13.0,2020
Marqués de Murrieta Rioja Gran Reserva 2014/15,46.99,75.0,Spain,10.5,"Black Fruit, Red Fruit, Vanilla",per bottle,Red,14.0,2015
"Louis Latour Marsannay Rouge 2021, Burgundy",34.99,75.0,France,10.1,"Strawberry, Cedar, Earth, Raspberry, Red Cherry",per bottle,Red,13.5,2021
Domaine Pierre Marchand 'Les Cigales' Pouilly-Fumé 2021/22,17.99,75.0,France,9.4,"Green Apple, Smoke, Stone Fruit, Vanilla",per bottle,White,12.5,2022
"Domaines Schlumberger 'Les Princes Abbés' Gewürztraminer 2020/21, Alsace",18.99,75.0,France,10.5,"White Pepper, Rose, Tropical Fruit",per bottle,White,14.0,2020
"Yellow Tail Pinot Grigio 2021/22, Australia",8.99,75.0,Australia,8.6,"Tropical Fruit, Citrus Fruit, Floral, Green Apple, Lime, Melon, Passionfruit, Peach",per bottle,White,11.5,2022
Fonseca ‘Quinta do Panascal’ Vintage Port 2008,32.99,75.0,Portugal,15.4,-,per bottle,Red,20.5,2008
Croft 10 Year Old Tawny Port,24.99,75.0,Portugal,15.0,"Jammy, Caramel, Fig",per bottle,Tawny,20.0,Non-Vintage
"Les Hauts de Castelmaure, Corbières 2020/21",13.99,75.0,France,10.9,"Dried Herbs, Black Pepper, Black Plum, Blackberry",per bottle,Red,14.5,2021
Bodegas Roda 'Roda I' Rioja Reserva 2015/16,55.99,75.0,Spain,10.9,"Vanilla, Black Fruit, Red Cherry, Red Fruit",per bottle,Red,14.5,2016
"Royal Tokaji 'Gold Label' 6 Puttonyos 2017, Hungary 50cl",51.99,50.0,Hungary,5.5,"Peach, Apricot, Dried Fruit, Orange Marmalade",per bottle,White,11.0,2017
Bodegas Hidalgo 'Triana' Pedro Ximénez Sherry,17.99,75.0,Spain,11.3,"Toffee, Caramel, Cinnamon, Dried Fruit",per bottle,White,15.0,Non-Vintage
"Yellow Tail Malbec 2021/22, Australia",8.99,75.0,Australia,10.1,"Jammy, Black Fruit, Black Plum, Blackcurrant, Chocolate",per bottle,Red,13.5,2022
"Torbreck 'Woodcutter's' Shiraz 2020/21, Barossa",23.99,75.0,Australia,11.3,"Vanilla, Black Cherry, Blackberry, Chocolate, Coffee, Liquorice, Prune, Spice",per bottle,Red,15.0,2021
"Pringle Bay Shiraz 2022/23, Western Cape",9.99,75.0,South Africa,10.5,"Black Cherry, Blackberry, Spice",per bottle,Red,14.0,2023
"Making Tracks Shiraz 2019/20, South Australia",10.99,75.0,Australia,10.9,"Vanilla, Black Pepper, Blackberry, Blackcurrant, Jammy",per bottle,Red,14.5,2020
"Chateau l'Hyverniere Muscadet 2020/21, Muscadet Sèvre et Maine",11.99,75.0,France,9.0,"Almond, Grapefruit, Green Apple, Lime, Pear",per bottle,White,12.0,2021
Gonzalez Byass Solera Cream Sherry,17.99,75.0,Spain,13.5,"Vanilla, Caramel, Date, Raisin",per bottle,White,18.0,Non-Vintage
"Two Hands 'Sexy Beast' Cabernet Sauvignon 2021/22, McLaren Vale",21.99,75.0,Australia,10.9,"Vanilla, Black Fruit, Black Plum, Blackberry, Blackcurrant, Chocolate, Coffee, Smoke, Tobacco",per bottle,Red,14.5,2022
Veuve Clicquot Demi-Sec Champagne,54.99,75.0,France,9.4,"Pear, Bread, Honey, Peach",per bottle,White,12.5,Non-Vintage
"Famille Hugel ‘Classic’ Riesling 2021/22, Alsace",22.99,75.0,France,9.8,"Lime, Peach, Red Apple, Wet Stones",per bottle,White,13.0,2022
"Penfolds 'Max's' Chardonnay 2019/22, Adelaide Hills",22.99,75.0,Australia,10.1,"Vanilla, Hazelnut, Lemon, Nectarine",per bottle,White,13.5,2022
Hidalgo 'Pastrana' Pasada Manzanilla Sherry,16.99,75.0,Spain,11.3,"Walnut, Almond, Cream",per bottle,White,15.0,Non-Vintage
Château de Thauvenay Sancerre 2021/22,24.99,750.0,France,9.4,"Citrus Fruit, Cream, Grass, Green Apple, Flint",per bottle,White,12.5,2021
Pieropan ‘Ruberpan’ Organic Valpolicella Superiore DOC 2019,29.99,75.0,Italy,10.5,"Red Cherry, Spice, Strawberry",per bottle,Red,14.0,2019
Parcel Series Pauillac 2019,29.99,75.0,France,9.8,-,per bottle,Red,13.0,2019
"Château Fourcas Dupré 2013, Listrac-Médoc",15.99,75.0,France,9.8,"Spice, Blackcurrant, Savoury",per bottle,Red,13.0,2013
"Krasno Sauvignon Blanc-Ribolla Gialla 2021/22, Brda",9.99,75.0,Slovenia,9.8,"Green Apple, Citrus Fruit, Grass",per bottle,White,13.0,2022
"Incanta Pinot Noir 2021/22, Romania",9.99,75.0,Romania,9.4,"Red Cherry, Black Cherry, Jammy",per bottle,Red,12.5,2022
Bollinger R.D. 2008 Champagne,310.0,75.0,France,9.0,"Citrus Fruit, Almond, Biscuit, Bread",per bottle,White,12.0,2008
"Château Tour Massac 2013/14, Margaux",36.99,75.0,France,9.8,"Black Fruit, Cedar, Leather, Mint, Spice, Tobacco",per bottle,Red,13.0,2014
"Château d'Esclans 'Garrus' Rosé, Côtes de Provence 2020/21",139.99,75.0,France,10.5,"Cream, Lemon, Peach, Raspberry, Strawberry",per bottle,Rosé,14.0,2021
Muga Rioja Blanco 2021/22,14.99,75.0,Spain,10.5,"Vanilla, Cream, Peach",per bottle,White,14.0,2022
Dom Perignon Brut Vintage Champagne,230.0,75.0,France,9.4,"Smoke, Biscuit, Bread, Green Apple, Peach, Pear",per bottle,White,12.5,2013
"Kanonkop 'Kadette' Pinotage Rosé 2022/23, Stellenbosch",14.99,75.0,South Africa,10.5,"Floral, Raspberry, Red Cherry",per bottle,Rosé,14.0,2022
"Château Tour Haut-Caussan 2014/17, Médoc",15.99,75.0,France,10.1,"Blackcurrant, Cedar, Earth, Spice",per bottle,Red,13.5,2017
"Definition Albariño 2021/22, Rías Baixas",13.99,75.0,Spain,9.8,"Peach, Apricot, Lemon",per bottle,White,13.0,2022
Rijckaert F. Rouve 'Haute Cuvée' Viré-Clessé 2020/21,24.99,75.0,France,9.8,"Peach, Apricot, Bread, Floral, Honey, Lemon",per bottle,White,13.0,2021
"Abbotts & Delaunay, Domaine de la Métairie d'Alon 'Le Village' Organic Chardonnay 2022, Languedoc",19.99,75.0,France,10.1,"Lemon, Peach, Banana, Hazelnut",per bottle,White,13.5,2021
La Rioja Alta 'Finca Martelo' Rioja Reserva 2016/19,27.99,75.0,Spain,10.9,"Black Plum, Spice, Vanilla",per bottle,Red,14.5,2019
"Definition Claret 2018/19, Medoc",13.99,75.0,France,10.1,"Cedar, Blackberry, Blackcurrant",per bottle,Red,13.5,2019
"Beato Bartolomeo Pinot Grigio Rosato 2021/22, Delle Venezie",9.99,75.0,Italy,9.4,"Peach, Apricot, Floral",per bottle,Rosé,12.5,2022
"Château de Berne ‘Inspiration’ Rosé 2021/22 Magnum, Côtes de Provence",37.99,1.5,France,19.5,"Raspberry, Strawberry, Watermelon",per bottle,Rosé,13.0,2021
"Château Le Boscq 2013, Saint-Estèphe",24.99,75.0,France,9.4,"Black Fruit, Cedar, Liquorice, Red Fruit",per bottle,Red,12.5,2013
"Château Minuty 'Cuvée Prestige' 2021/22, Côtes de Provence",23.99,75.0,France,9.8,"Strawberry, Herbaceous, Peach, Raspberry",per bottle,Rosé,13.0,2022
"Maison Saint Aix 'AIX' Rosé 2021/22 Magnum, Coteaux d'Aix en Provence",35.99,150.0,France,19.5,"Strawberry, Herbaceous, Peach, Raspberry",per bottle,Rosé,13.0,2022
"Muga Rioja Rosado 2021/22, Rioja",13.99,75.0,Spain,10.1,"Strawberry, Peach, Raspberry, Red Apple",per bottle,Rosé,13.5,2022
"The Pale Rosé by Sacha Lichine 2021/22, IGP Var",16.99,75.0,France,9.4,"Grapefruit, Raspberry, Strawberry",per bottle,Rosé,12.5,2021
"Vieux Remparts 2019/20, Lussac St-Émilion",13.99,75.0,France,10.1,"Spice, Blackcurrant, Game, Red Plum, Smoke",per bottle,Red,13.5,2020
"19 Crimes Red Blend, Australia",9.99,75.0,Australia,10.5,"Black Plum, Blackcurrant, Vanilla",per bottle,Red,14.0,Non-Vintage
"Acacia Road Chardonnay 2020/22, South Africa",7.99,75.0,South Africa,9.8,"Stone Fruit, Citrus Fruit, Floral",per bottle,White,13.0,2022
"Acacia Road Chenin Blanc 2022/23, South Africa",7.99,75.0,South Africa,9.4,"Stone Fruit, Citrus Fruit, Floral",per bottle,White,12.5,2023
"Acacia Road Merlot 2022/23, South Africa",7.99,75.0,South Africa,9.8,"Red Cherry, Blackberry, Blackcurrant",per bottle,Red,13.0,2022
Acacia Road Sauvignon Blanc 2022/23,7.99,75.0,South Africa,9.4,"Stone Fruit, Citrus Fruit, Floral",per bottle,White,12.5,2023
"Alain Grignon Carignan 'Vieilles Vignes' 2022, Pays de l'Hérault",8.99,75.0,France,9.8,"Spice, Black Fruit, Dried Herbs",per bottle,Red,13.0,2022
Allegrini Amarone della Valpolicella Classico DOCG 2017/18,79.99,75.0,Italy,12.0,"Vanilla, Chocolate, Fig, Red Cherry, Red Plum, Sweet Spice",per bottle,Red,16.0,2018
Alphonse Mellot 'Les Demoiselle' Organic Sancerre 2019/21,39.99,75.0,France,10.5,"Green Apple, Citrus Fruit, Cream, Grass",per bottle,White,14.0,2021
Alphonse Mellot 'Les Demoiselles' Organic Sancerre Rouge 2019/20,39.99,75.0,France,10.9,"Red Cherry, Cranberry, Raspberry",per bottle,Red,14.5,2020
Ammazza Montepulciano 2020/21,7.99,75.0,Italy,9.8,"Strawberry, Raspberry, Red Cherry",per bottle,Red,13.0,2021
"Ammazza Pinot Grigio 2020/21, Terre di Chieti IGT",8.49,75.0,Italy,9.0,"Lime, Floral, Lemon",per bottle,White,12.0,2022
"Anna's Way Viognier 2021/22, Marlborough",12.99,75.0,New Zealand,10.9,"Peach, Apricot, Floral",per bottle,White,14.5,2021
"Araldica Barbera d'Asti DOCG 2019/20, Italy",9.99,75.0,Italy,10.9,"Sweet Spice, Red Cherry, Red Plum, Spice",per bottle,Red,14.5,2020
Araldica Barolo DOCG 2018/19,21.99,75.0,Italy,10.5,"Spice, Earth, Red Fruit",per bottle,Red,14.0,2019
"Avior Malbec 2020/21, Argentina",7.99,75.0,Argentina,9.8,"Violet, Black Fruit, Red Fruit, Ripe Fruit",per bottle,Red,13.0,2021
"Babich Organic Sauvignon Blanc 2022, Marlborough",15.99,75.0,New Zealand,9.8,"Tropical Fruit, Grass, Green Apple, Lemon",per bottle,White,13.0,2022
"Bodega Matsu ‘El Viejo’ 2019/20, Toro",26.99,75.0,Spain,11.3,"Spice, Black Cherry, Blackcurrant, Cedar",per bottle,Red,15.0,2020
"Bodega Matsu 'El Picaro' 2021/22, Toro",11.99,75.0,Spain,10.9,"Cedar, Black Cherry, Blackcurrant",per bottle,Red,14.5,2022
