Title,Price,Capacity,Country,Unit,Characteristics,Quantity,Type,ABV,Vintage
"The Guv'nor, Spain",9.99,75.0,Spain,10.5,"Vanilla, Blackberry, Blackcurrant",per bottle,Red,14.0,Non-Vintage
"Bread & Butter 'Winemaker's Selection' Chardonnay 2020/21, California",15.99,75.0,USA,10.1,"Vanilla, Almond, Coconut, Green Apple, Peach, Pineapple, Stone Fruit",per bottle,White,13.5,2021
"Oyster Bay Sauvignon Blanc 2022, Marlborough",12.49,75.0,New Zealand,9.8,"Tropical Fruit, Gooseberry, Grapefruit, Grass, Green Apple, Lemon, Stone Fruit",per bottle,White,13.0,2022
Louis Latour Mâcon-Lugny 2021/22,17.99,75.0,France,10.1,"Peach, Apricot, Floral, Lemon",per bottle,White,13.5,2022
"Bread & Butter 'Winemaker's Selection' Pinot Noir 2021, California",15.99,75.0,USA,10.1,"Smoke, Black Cherry, Cedar, Raspberry, Red Fruit",per bottle,Red,13.5,2021
Louis Roederer 'Cristal' Champagne 2015,300.0,75.0,France,9.0,-,per bottle,White,12.0,2015
"La Gioiosa Prosecco DOC, Treviso",12.99,75.0,Italy,8.3,"Green Apple, Citrus Fruit, Floral",per bottle,White,11.0,Non-Vintage
The Macallan Sherry Oak 12 Year Old Single Malt Whisky 70cl,80.0,70.0,Scotland,28.0,-,per bottle,Brown,40.0,Non-Vintage
Bouvet Ladubay Saumur Brut,13.99,75.0,France,9.4,"Honeysuckle, Citrus Fruit",per bottle,White,12.5,Non-Vintage
"LB7 Red 2020/21, Lisbon",8.99,75.0,Portugal,10.1,"Spice, Black Fruit, Black Plum, Blackberry",per bottle,Red,13.5,2021
"The Ned 'Waihopai River' Sauvignon Blanc 2023, Marlborough",11.99,75.0,New Zealand,9.8,"Tropical Fruit, Gooseberry, Grapefruit, Grass, Green Apple, Lemon",per bottle,White,13.0,2023
Moët & Chandon 'Brut Impérial' Champagne,46.99,75.0,France,9.0,"Citrus Fruit, Biscuit, Bread",per bottle,White,12.0,Non-Vintage
"Chosen By Majestic Greek White 2022, Peloponnese",11.29,75.0,Greece,9.8,"Blossom, Lemon, Lime, Peach, Pear",per bottle,White,13.0,2022
"Miraval Rosé 2021/22, Côtes de Provence",22.99,75.0,France,9.8,"Strawberry, Herbaceous, Peach, Raspberry",per bottle,Rosé,13.0,2022
Taittinger Brut Réserve Champagne,45.99,75.0,France,9.4,-,per bottle,White,12.5,Non-Vintage
"Peyrassol 'Réserve des Templiers' Rosé 2022, Côtes de Provence",15.99,75.0,France,9.8,"Strawberry, Herbaceous, Peach, Raspberry",per bottle,Rosé,13.0,2022
Laurent-Perrier 'La Cuvée' Brut Champagne,49.99,75.0,France,9.0,"Green Apple, Biscuit, Bread, Citrus Fruit",per bottle,White,12.0,Non-Vintage
Heidsieck & Co. Monopole 'Gold Top' Champagne 2018,33.99,75.0,France,9.4,"Pear, Biscuit, Cream, Green Apple, Lemon, Quince, Red Apple",per bottle,White,12.5,2018
"Caves d'Esclans 'Whispering Angel' Rosé 2022, Côtes de Provence",23.99,75.0,France,10.1,"Strawberry, Herbaceous, Peach, Raspberry",per bottle,Rosé,13.5,2022
"Two Hands 'Angels' Share' Shiraz 2021/22, McLaren Vale",21.99,75.0,Australia,10.8,"Vanilla, Black Fruit, Black Pepper, Blackcurrant, Blueberry, Coffee, Jammy, Raisin, Red Fruit, Red Plum",per bottle,Red,14.4,2022
Cave de Lugny 'Reserve' Mâcon-Chardonnay 2021/22,15.99,75.0,France,9.8,"Peach, Apricot, Floral, Honey, Lemon",per bottle,White,13.0,2022
"Villa Maria 'Private Bin' Sauvignon Blanc 2022, Marlborough",12.49,75.0,New Zealand,9.4,"Tropical Fruit, Gooseberry, Grapefruit, Grass, Green Apple, Lemon, Stone Fruit",per bottle,White,12.5,2022
"Nyetimber 'Classic Cuvée' Brut, Sussex",42.99,75.0,England,9.0,"Peach, Biscuit, Bread, Citrus Fruit, Green Apple",per bottle,White,12.0,Non-Vintage
La Gioiosa Prosecco Valdobbiadene DOCG,15.99,75.0,Italy,8.3,"Pear, Citrus Fruit, Floral, Green Apple",per bottle,White,11.0,Non-Vintage
"Definition English Sparkling Brut, Hampshire",29.99,75.0,England,9.0,"Citrus Fruit, Cream, Green Apple, Pastry",per bottle,White,12.0,Non-Vintage
"Chapel Down Brut, Kent",29.99,75.0,England,9.8,"Pear, Cream, Green Apple",per bottle,White,13.0,Non-Vintage
"Mud House Sauvignon Blanc 2022, Marlborough",11.99,75.0,New Zealand,9.4,"Tropical Fruit, Grass, Green Apple, Lemon, Stone Fruit",per bottle,White,12.5,2022
"Château de Berne ‘Inspiration’ Rosé 2021/22, Côtes de Provence",17.99,75.0,France,9.8,"Strawberry, Herbaceous, Peach, Raspberry",per bottle,Rosé,13.0,2022
"Domaine La Chautarde Rosé 2022, Côteaux Varois en Provence",13.99,75.0,France,9.8,"Strawberry, Peach, Raspberry",per bottle,Rosé,13.0,2022
Marqués de Riscal Rioja Reserva 2018/19,17.99,75.0,Spain,10.9,"Vanilla, Black Fruit, Red Fruit",per bottle,Red,14.5,2019
"Ridgeview 'Cavendish' Brut, Sussex",39.99,750.0,England,9.0,"Almond, Lemon, Red Cherry, Toast",per bottle,White,12.0,Non-Vintage
"The Ned ‘Skyscraper’ Sauvignon Blanc 2022, Marlborough",14.99,75.0,New Zealand,10.1,"Grapefruit, Grass, Green Apple, Lemon, Stone Fruit, Tropical Fruit, Wet Stones",per bottle,White,13.5,2022
"The Guv'nor VIP, Spain",11.99,75.0,Spain,10.5,"Cloves, Nutmeg, Ripe Fruit",per bottle,Red,14.0,Non-Vintage
Chanoine Frères 'Réserve Privée' Brut Champagne,45.99,75.0,France,9.4,"Bread, Citrus Fruit",per bottle,White,12.5,Non-Vintage
"Bread & Butter 'Winemaker's Selection' Cabernet Sauvignon 2021, California",15.99,75.0,USA,10.1,"Vanilla, Black Pepper, Blackcurrant, Coffee",per bottle,Red,13.5,2021
"Balfour ‘The White’ 2021, Kent",16.99,750.0,England,8.3,"Apricot, Blossom, Dried Herbs, Peach",per bottle,White,11.0,2021
Lanson 'Le Black Creation' Brut Champagne,42.99,75.0,France,9.4,"Honey, Bread, Citrus Fruit",per bottle,White,12.5,Non-Vintage
Jas des Vignes Rosé Méditerranée 2021/22,11.99,75.0,France,9.8,"Strawberry, Peach, Raspberry",per bottle,Rosé,13.0,2022
"The Gathering Storm Red 2022, Spain",7.99,75.0,Spain,9.0,-,per bottle,Red,12.0,2022
"Peyrassol ‘Les Commandeurs’ Organic Rosé, Côtes de Provence 2022",18.99,75.0,France,9.8,"Citrus Fruit, Red Fruit, Mineral",per bottle,Rosé,13.0,2022
"Abbotts & Delaunay 'Les Fleurs Sauvages' Viognier 2021/22, Languedoc",11.99,75.0,France,10.1,"Peach, Apricot, Blossom",per bottle,White,13.5,2022
"Beato Bartolomeo Pinot Grigio Superiore, Breganze DOC 2022",9.99,75.0,Italy,9.4,"Lime, Floral, Lemon",per bottle,White,12.5,2022
"Nyetimber Brut Rosé, Sussex",49.99,75.0,England,9.0,"Red Fruit, Pastry, Raspberry",per bottle,Rosé,12.0,Non-Vintage
"Brancott Estate Sauvignon Blanc 2022, Marlborough",12.49,75.0,New Zealand,10.1,"Grass, Green Apple, Green Bell Pepper, Lemon, Tropical Fruit",per bottle,White,13.5,2022
Cave de Lugny 'Les Chenaudières' Bourgogne Chardonnay 2022,14.99,75.0,France,9.8,"Vanilla, Butter, Lemon, Peach",per bottle,White,13.0,2022
"The Guv'nor Rosé, Spain",8.99,75.0,Spain,9.8,"Nectarine, Raspberry, Strawberry",per bottle,Rosé,13.0,Non-Vintage
"Chapel Down English Sparkling Rosé, Kent",29.99,75.0,England,9.0,"Strawberry, Raspberry, Red Fruit",per bottle,Rosé,12.0,Non-Vintage
Heidsieck & Co. Monopole 'Bronze Top' Brut Champagne,29.99,75.0,France,9.4,"Pear, Bread, Citrus Fruit",per bottle,White,12.5,Non-Vintage
"Viñalba 'Reserve' Malbec 2020/21, Mendoza",12.99,75.0,Argentina,10.9,"Violet, Black Fruit, Red Fruit, Ripe Fruit, Vanilla",per bottle,Red,14.5,2020/21
La Raia 'Il Borgo' Organic Gavi 2021,14.99,75.0,Italy,9.8,"Lime, Citrus Fruit, Floral, Green Apple, Lemon",per bottle,White,13.0,2021
"La Marca Extra Dry Prosecco, Conegliano Valdobbiadene DOCG",14.99,75.0,Italy,8.3,"Pear, Citrus Fruit, Floral, Green Apple",per bottle,White,11.0,2021
"Les Vignobles Foncalieu 'Vallée des Pins' Rosé 2021/22, Coteaux d'Aix-en-Provence",11.99,75.0,France,9.4,"Strawberry, Peach, Raspberry",per bottle,Rosé,12.5,2022
Château Recougne Bordeaux Supérieur 2019/20,12.99,75.0,France,10.9,"Smoke, Blackberry, Red Plum",per bottle,Red,14.5,2020
"Devil's Creek Sauvignon Blanc 2022, Marlborough",9.99,75.0,New Zealand,9.8,"Tropical Fruit, Grass, Green Apple, Lemon, Stone Fruit",per bottle,White,13.0,2022
"Two Hands 'Tenacity' Old Vine Shiraz 2021/22, Australia",14.99,75.0,Australia,10.7,"Vanilla, Black Pepper, Black Plum, Blackberry, Blackcurrant, Blueberry, Chocolate, Jammy, Spice",per bottle,Red,14.2,2022
"Olivier Dubois 'Cuvée Prestige' Pinot Noir 2021/22, France",9.99,75.0,France,9.4,"Strawberry, Cranberry, Red Cherry",per bottle,Red,12.5,2022
"Saint Clair 'Pioneer Block' Sauvignon Blanc 2020/21, Wairau Valley",19.99,75.0,New Zealand,9.8,"Tropical Fruit, Grass, Green Apple, Lemon, Stone Fruit",per bottle,White,13.0,2021
Domaine de la Tourmaline ‘Sur Lie’ Muscadet de Sèvre et Maine 2021/22,10.99,75.0,France,9.0,"Pear, Bread, Green Apple, Lemon, Lime",per bottle,White,12.0,2022
Domaine des Patureaux Organic Pouilly-Fumé 2021/22,18.99,75.0,France,10.1,"Smoke, Citrus Fruit, Grass, Green Apple",per bottle,White,13.5,2022
Definition Chablis 2022,17.99,75.0,France,9.4,"Wet Stones, Green Apple, Lemon",per bottle,White,12.5,2022
Domaine Jean-Max Roger ‘Cuvée Genese’ Sancerre 2021/22,23.99,75.0,France,10.1,"Green Apple, Citrus Fruit, Grass",per bottle,White,13.5,2022
Nicolas Feuillatte 2012/15 Champagne,34.99,75.0,France,9.0,"Pear, Biscuit, Green Apple, Pastry",per bottle,White,12.0,2015
Chosen by Majestic Prosecco DOC,9.99,750.0,Italy,8.3,"Floral, Peach, Pear",per bottle,White,11.0,Non-Vintage
Pommery 'Brut Royal' Champagne,43.99,75.0,France,9.4,"Honey, Almond, Citrus Fruit, Floral, Green Apple",per bottle,White,12.5,Non-Vintage
"Rocklin Ranch Cabernet Sauvignon 2020/21, Monterey",18.99,75.0,USA,10.9,"Vanilla, Black Fruit, Black Plum, Blackberry, Blueberry",per bottle,Red,14.5,2021
"Rocklin Ranch Chardonnay 2020/21, Monterey",18.99,75.0,USA,10.1,"Vanilla, Butter, Green Apple, Lemon, Peach, Tropical Fruit",per bottle,White,13.5,2021
"Rocklin Ranch Pinot Noir 2020/21, Monterey",18.99,75.0,USA,10.1,"Vanilla, Cloves, Raspberry, Red Cherry, Red Fruit, Spice",per bottle,Red,13.5,2021
"Mayu Carménère Appassimento 2019/20, Chile",12.99,75.0,Chile,10.9,"Vanilla, Black Plum, Blackberry, Green Bell Pepper, Spice, Sweet Spice",per bottle,Red,14.5,2020
"Definition Zinfandel 2019/20, Lodi",10.99,75.0,USA,10.9,"Spice, Black Cherry, Blueberry, Raspberry",per bottle,Red,14.5,2020
Langlois-Chateau 'Classique' Crémant de Loire Brut,19.99,75.0,France,9.4,"Citrus Fruit, Pastry, Pear",per bottle,White,12.5,Non-Vintage
"Jim Barry 'The Lodge Hill' Shiraz 2020/21, Clare Valley",15.99,75.0,Australia,10.5,"Vanilla, Black Plum, Blackberry, Blackcurrant, Blueberry, Chocolate, Cloves, Sweet Spice, Tobacco",per bottle,Red,14.0,2021
"Rustenberg 'RM Nicholson' 2020/21, Stellenbosch",14.99,75.0,South Africa,10.5,"Vanilla, Black Pepper, Blackberry, Blackcurrant, Cedar, Leather, Spice",per bottle,Red,14.0,2021
"Klein Constantia Sauvignon Blanc 2020/21, Constantia",15.99,75.0,South Africa,10.1,"Grass, Citrus Fruit, Floral",per bottle,White,13.5,2021
"Vasse Felix 'Filius' Chardonnay 2021/22, Margaret River",14.99,75.0,Australia,9.8,"Vanilla, Butter, Green Apple, Lemon, Peach, Smoke",per bottle,White,13.0,2022
"Château Fontesteau 2014, Haut-Médoc",16.99,75.0,France,9.8,"Blackcurrant, Mint, Savoury",per bottle,Red,13.0,2014
"Rustenberg Sauvignon Blanc 2021/22, Stellenbosch",14.99,75.0,South Africa,10.1,"Grass, Citrus Fruit, Floral",per bottle,White,13.5,2022
Devaux Blanc de Noirs Champagne,29.99,75.0,France,9.0,"Red Fruit, Raspberry, Red Cherry",per bottle,White,12.0,Non-Vintage
Gabriel Allard Côtes du Rhône Blanc 2022,9.99,75.0,France,9.8,"Citrus Fruit, Floral, Stone Fruit",per bottle,White,13.0,2022
"Peter Lehmann 'The Barossan' Shiraz 2019/20, Barossa",18.99,75.0,Australia,10.9,"Smoke, Black Pepper, Black Plum, Blackberry, Blackcurrant, Blueberry, Chocolate, Coffee, Leather",per bottle,Red,14.5,2020
Marqués de Cáceres Rioja Gran Reserva 2014/15,22.99,75.0,Spain,10.9,"Vanilla, Black Fruit, Red Fruit, Spice",per bottle,Red,14.5,2015
Chosen by Majestic Grüner Veltliner Kremstal DAC 2022,11.29,75.0,Austria,9.4,"Lemon, Peach, Quince, Red Apple, White Pepper",per bottle,White,12.5,2022
Chosen by Majestic Valpolicella Superiore DOC 2020/21,11.99,75.0,Italy,9.8,"Black Fruit, Red Cherry, Spice, Vanilla",per bottle,Red,13.0,2021
Maison Chanzy 'En Rosey' Rully Rouge 2019/20,24.99,75.0,France,10.5,"Strawberry, Cranberry, Red Cherry",per bottle,Red,14.0,2020
Triplica Greco di Tufo DOCG 2021/22,12.99,75.0,Italy,9.8,"Stone Fruit, Citrus Fruit, Floral",per bottle,White,13.0,2021
"Vilarnau ‘Gaudi’ Organic Cava Brut Reserva, Penedès",13.99,750.0,Spain,8.6,"Bread, Green Apple, Pastry, Pear",per bottle,White,11.5,Non-Vintage
"Pardon et Fils Fleurie 2021/22, Côte des Labourons",15.99,75.0,France,10.1,"Strawberry, Black Cherry, Raspberry",per bottle,Red,13.5,2022
"Peyrassol 'Réserve des Templiers' Rosé 2021/22 Magnum, Côtes de Provence",35.99,1.5,France,19.5,"Herbaceous, Peach, Raspberry, Strawberry",per bottle,Rosé,13.0,2022
"Rustenberg Cabernet Sauvignon, 2020/21 Stellenbosch",14.99,75.0,South Africa,10.5,"Tobacco, Black Fruit, Black Plum, Blackcurrant, Earth",per bottle,Red,14.0,2021
Baron de Boutisse Saint-Émilion Grand Cru 2018/19,19.99,75.0,France,10.9,"Cedar, Black Plum, Blackcurrant",per bottle,Red,14.5,2019
"Chosen by Majestic Pinot Noir 2022, France",9.99,75.0,France,9.4,"Red Cherry, Red Fruit, Sweet Spice",per bottle,Red,12.5,2022
Chosen by Majestic Vinho Verde DOC 2022,8.99,75.0,Portugal,8.3,"Citrus Fruit, Green Apple, Lemon",per bottle,White,11.0,2022
Gabriel Allard Côtes du Rhône Rouge 2022,9.99,75.0,France,10.9,"Black Pepper, Black Plum, Red Fruit",per bottle,Red,14.5,2022
Alain Jaume 'Roquedon' Organic Lirac 2018/19,18.99,75.0,France,11.3,"Spice, Black Plum, Blackberry, Earth, Raspberry",per bottle,Red,15.0,2019
"Mirabeau 'Pure' Rosé 2021/22 Magnum, Côtes de Provence",37.99,1.5,France,19.5,"Herbaceous, Peach, Raspberry, Strawberry",per bottle,Rosé,13.0,2022
"Jim Barry 'The Lodge Hill' Riesling 2021/22, Clare Valley",15.99,75.0,Australia,9.4,"Petrol, Citrus Fruit, Grapefruit, Green Apple, Honeysuckle, Lemon, Lime, Orange, Peach, Pear",per bottle,White,12.5,2022
"Nettie Viognier 2019/21, California",11.99,75.0,USA,10.5,"Pear, Apricot, Floral, Honey, Peach",per bottle,White,14.0,2021
"Thierry Delaunay 'Manoir' Sauvignon Blanc 2021/22, Touraine",12.99,75.0,France,9.8,"Green Apple, Citrus Fruit, Grass",per bottle,White,13.0,2022
Lanson Le Black Label Brut Champagne Magnum,99.99,1.5,France,18.8,"Bread, Citrus Fruit, Honey",per bottle,White,12.5,Non-Vintage
"Wind and Waves Alvarinho 2022, Vinho Verde DOC",11.99,75.0,Portugal,9.0,"Citrus Fruit, Floral, Tropical Fruit",per bottle,White,12.0,2022
Lanson Le Blanc de Blancs Brut Champagne,75.99,75.0,France,9.4,-,per bottle,White,12.5,Non-Vintage
"Mud House Chilean Sauvignon Blanc 2021/22, Central Valley",9.99,75.0,Chile,9.4,"Citrus Fruit, Grass, Tropical Fruit",per bottle,White,12.5,2022
"Château d'Anglès 'Grand Vin' 2019/20, La Clape",18.99,75.0,France,10.9,"Spice, Black Fruit, Dried Herbs",per bottle,Red,14.5,2020
Bouvet Ladubay Saumur Rosé Brut,14.99,75.0,France,9.4,"Strawberry, Floral, Peach, Raspberry, Red Fruit",per bottle,Rosé,12.5,Non-Vintage
"Petaluma ‘White Label’ Sauvignon Blanc 2021, Adelaide Hills",19.99,75.0,Australia,9.4,"Grapefruit, Grass, Lemon, Melon, Passionfruit",per bottle,White,12.5,2021
"Beato Bartolomeo ‘Naturae' Pinot Noir 2021, Veneto",11.99,75.0,Italy,9.0,"Raspberry, Red Fruit, Strawberry",per bottle,Red,12.0,2021
"Beato Bartolomeo ‘Naturae' Vespaiolo 2022, Breganze DOC",11.99,75.0,Italy,9.0,"Grapefruit, Honey, Lemon",per bottle,White,12.0,2022
Chosen by Majestic Picpoul de Pinet 2022,11.29,75.0,France,9.0,"Citrus Fruit, Green Apple, Mineral",per bottle,White,12.0,2022
Piccini ‘Histrio’ Organic Anfora Toscana Bianco 2022,12.99,75.0,Italy,9.4,"Floral, Spice, Tropical Fruit",per bottle,White,12.5,2022
Piccini ‘Histrio’ Organic Anfora Toscana Rosso 2020,12.99,75.0,Italy,10.1,"Floral, Red Cherry, Red Fruit",per bottle,Red,13.5,2020
"Château Minuty 'M de Minuty' Rosé 2021/22, Côtes de Provence",17.99,75.0,France,9.8,"Strawberry, Herbaceous, Peach, Raspberry",per bottle,Rosé,13.0,2022
Nicolas Feuillatte 'Grande Réserve' Brut Champagne,29.99,750.0,France,9.0,-,per bottle,White,12.0,Non-Vintage
Louis Jadot 'Les Roches Blanches' Mâcon-Villages 2022,16.99,75.0,France,9.8,"Peach, Apricot, Floral, Lemon",per bottle,White,13.0,2022
"Toast & Honey Chardonnay 2021, California",14.99,75.0,USA,9.8,"Almond, Coconut, Green Apple, Honey, Peach, Pineapple, Stone Fruit, Vanilla, Toast",per bottle,White,13.0,2021
Domini Veneti 'La Casetta' Valpolicella Ripasso DOC Superiore 2019,18.99,75.0,Italy,10.9,"Vanilla, Fig, Red Cherry, Red Plum, Sweet Spice",per bottle,Red,14.5,2019
Langlois-Chateau 'L'Extra par Langlois' Crémant de Loire Brut,15.99,75.0,France,9.4,"Bread, Green Apple, Pear",per bottle,White,12.5,Non-Vintage
"The Guv'nor Blanco, Spain",8.99,75.0,Spain,9.4,"Lime, Fennel, Green Apple",per bottle,White,12.5,Non-Vintage
E. Guigal Côtes du Rhône 2019/20,14.99,75.0,France,11.3,"White Pepper, Black Plum, Blackberry, Earth, Raspberry, Spice",per bottle,Red,15.0,2020
"Ridgeview 'Fitzrovia' Rosé, Sussex",43.99,750.0,England,9.0,"Honey, Lemon, Raspberry, Red Cherry",per bottle,Rosé,12.0,Non-Vintage
"Toast & Honey Pinot Noir 2021/22, California",14.99,75.0,USA,9.8,"Black Cherry, Cedar, Raspberry, Red Fruit, Smoke, Toast",per bottle,Red,13.0,2022
"Selladore en Provence Rosé 2021, Coteaux Varois en Provence",21.99,75.0,France,9.8,"Citrus Fruit, Red Fruit, Mineral",per bottle,Rosé,13.0,2021
Definition Gavi di Gavi DOCG 2021/22,14.99,75.0,Italy,9.4,"Green Apple, Herbaceous, Pear",per bottle,White,12.5,2022
"Pasqua 'Desire, Lush & Zin' Primitivo 2021/22, Puglia",12.99,75.0,Italy,10.1,"Vanilla, Black Fruit, Black Plum",per bottle,Red,13.5,2022
La Toledana Gavi di Gavi DOCG 2021,15.99,75.0,Italy,9.8,"Lime, Citrus Fruit, Floral, Green Apple, Lemon",per bottle,White,13.0,2021
"Toast & Honey Cabernet Sauvignon 2021, California",14.99,75.0,USA,9.8,-,per bottle,Red,13.0,2021
"The Guv'nor Sparkling, Spain",9.99,75.0,Spain,9.4,"Citrus Fruit, Peach, Vanilla",per bottle,White,12.5,Non-Vintage
"Beefsteak Club Malbec 2021/22, Mendoza",9.99,75.0,Argentina,10.1,"Violet, Black Fruit, Red Fruit, Ripe Fruit",per bottle,Red,13.5,2022
"Finca Carelio Tempranillo 2018/19, Spain",9.99,75.0,Spain,10.9,"Cedar, Black Cherry, Blackcurrant",per bottle,Red,14.5,2019
Louis Roederer 'Collection 243' Brut Champagne,61.99,750.0,France,9.4,"Biscuit, Bread, Citrus Fruit",per bottle,White,12.5,Non-Vintage
Château Méaume Bordeaux Supérieur 2019/20,13.99,75.0,France,10.9,"Tobacco, Black Plum, Blackcurrant, Cedar, Leather",per bottle,Red,14.5,2020
Maison Alexandre Gauvin Gevrey-Chambertin 2017/19,57.99,75.0,France,10.1,"Strawberry, Earth, Raspberry, Red Cherry",per bottle,Red,13.5,2019
Definition White Burgundy 2021/22,14.99,75.0,France,9.8,"Vanilla, Cream, Lemon, Peach",per bottle,White,13.0,2021
Domaine la Troupe ‘Cuvée Marie’ Viré-Clessé 2020/21,16.99,75.0,France,9.8,"Citrus Fruit, Green Apple, Stone Fruit",per bottle,White,13.0,2021
"Primo Rosso Appassimento 2021/22, Puglia",11.99,75.0,Italy,10.9,"Vanilla, Black Fruit, Black Plum",per bottle,Red,14.5,2022
Château d’Estoublon ‘Roseblood’ Rosé Méditerranée 2022,20.99,75.0,France,9.4,"Citrus Fruit, Peach, Red Fruit",per bottle,Rosé,12.5,2022
"Capaia One 2019/20, Tygerberg",15.99,75.0,South Africa,10.9,"Spice, Blackberry, Blackcurrant, Cedar, Leather",per bottle,Red,14.5,2020
"Barista Pinotage 2021/22, Western Cape",11.99,75.0,South Africa,9.8,"Vanilla, Black Fruit, Black Plum, Chocolate, Coffee",per bottle,Red,13.0,2022
"Men in White Coats Viognier 2022, Western Cape",9.99,75.0,South Africa,10.1,"Tropical Fruit, Citrus Fruit, Floral, Stone Fruit",per bottle,White,13.5,2022
"Definition Viognier 2020/21, Languedoc",11.99,75.0,France,10.5,"Peach, Apricot, Honeysuckle",per bottle,White,14.0,2021
"Alluria Organic Pinot Grigio 2021/22, Sicily",9.99,75.0,Italy,9.0,"Peach, Citrus Fruit, Floral",per bottle,White,12.0,2022
"Pringle Bay Sauvignon Blanc 2021/22, Western Cape",9.99,75.0,South Africa,9.4,"Gooseberry, Grapefruit, Grass, Green Apple, Lemon, Tropical Fruit",per bottle,White,12.5,2022
Taittinger Prestige Brut Rosé Champagne,57.99,75.0,France,9.4,"Raspberry, Red Cherry, Strawberry",per bottle,Rosé,12.5,Non-Vintage
Bouvet Ladubay 'Blanc de Blancs' Crémant de Loire 2020/21,18.99,75.0,France,9.4,"Pear, Floral, Green Apple",per bottle,White,12.5,2021
"Brio de Cantenac Brown 2015, Margaux",44.99,75.0,France,10.5,"Red Fruit, Savoury, Spice",per bottle,Red,14.0,2015
"Gérard Bertrand 'Côte des Roses' Rosé 2021/22, Languedoc",13.99,75.0,France,10.1,"Strawberry, Floral, Grapefruit, Peach, Raspberry",per bottle,Rosé,13.5,2022
Piper-Heidsieck 'Cuvée Brut' Champagne,39.99,75.0,France,9.0,"Almond, Green Apple, Lemon",per bottle,White,12.0,Non-Vintage
Jean-Pierre Bailly ‘Les Griottes’ Pouilly-Fumé 2021/22,19.99,75.0,France,10.5,"Smoke, Citrus Fruit, Grass, Green Apple",per bottle,White,14.0,2022
"Barista Chardonnay 2021/22, Western Cape",11.99,75.0,South Africa,10.1,"Vanilla, Cream, Stone Fruit",per bottle,White,13.5,2022
Famille Brocard Chablis 2021/22,19.99,75.0,France,9.8,"Citrus Fruit, Grapefruit, Lemon",per bottle,White,13.0,2022
Agostina Pieri Brunello di Montalcino DOCG 2017/18,36.99,75.0,Italy,11.6,"Spice, Black Fruit, Herbaceous",per bottle,Red,15.5,2018
"Casa Ermelinda Freitas Alicante Bouschet Reserva 2019, Setúbal",16.99,75.0,Portugal,10.9,"Black Fruit, Blackberry, Earth, Sweet Spice",per bottle,Red,14.5,2019
"Bread & Butter Reserve Pinot Noir 2020/21, Russian River Valley",29.99,750.0,USA,10.9,"Black Cherry, Raspberry, Red Cherry, Strawberry, Sweet Spice",per bottle,Red,14.5,2021
"Pasqua DLZ ‘Idealysta’ Chardonnay-Fiano 2022, Puglia",12.99,75.0,Italy,9.4,"Apricot, Orange, Peach, Stone Fruit",per bottle,White,12.5,2022
"Villiera Cap Classique Brut, Stellenbosch",16.99,750.0,South Africa,8.6,"Bread, Citrus Fruit, Red Apple",per bottle,White,11.5,Non-Vintage
Laurent-Perrier Millésimé 2012 Brut Champagne,69.99,75.0,France,9.0,"Apricot, Lemon, Pastry",per bottle,White,12.0,2012
"Chapel Down Bacchus 2021/22, Kent",17.99,75.0,England,9.4,"Grass, Citrus Fruit, Gooseberry, Grapefruit",per bottle,White,12.5,2022
Louis Violland Mercurey Blanc 2018/19,24.99,75.0,France,10.5,"Floral, Green Apple, Peach",per bottle,White,14.0,2019
Chosen by Majestic Beaujolais Villages 2022,11.99,75.0,France,9.8,"Blackcurrant, Raspberry, Red Fruit",per bottle,Red,13.0,2022
"Pasqua DLZ 'Idealysta' Rosé 2022, Puglia",12.99,75.0,Italy,9.4,"Red Apple, Red Cherry, Strawberry",per bottle,Rosé,12.5,2022
"Gérard Bertrand 'Hampton Water' Rosé 2021/22, Languedoc",17.99,75.0,France,10.1,"Floral, Peach, Raspberry, Strawberry",per bottle,Rosé,13.5,2022
"Domaine Aimé Arnoux Viognier 2021/22, Rhone Valley",11.99,75.0,France,9.8,"Apricot, Fig, Peach, Stone Fruit",per bottle,White,13.0,2021
"Managers’ Choice: Zocker Grüner Veltliner 2019/20, Edna Valley",17.99,75.0,USA,10.1,"Lemon, Lime, Melon, Pear, White Pepper",per bottle,White,13.5,2020
Inama Soave Classico DOC 2021/22,16.99,75.0,Italy,9.0,"Honey, Almond, Citrus Fruit, Floral",per bottle,White,12.0,2022
"Casella 'PepperBox' Shiraz 2020/21, South Eastern Australia",11.99,75.0,Australia,10.5,"Black Pepper, Black Plum, Spice, Vanilla",per bottle,Red,14.0,2021
"Winemaker Series Godello 2020/22, Monterrei",12.99,75.0,Spain,9.8,"Pear, Grapefruit, Lemon",per bottle,White,13.0,2022
Definition Fleurie 2021,13.99,75.0,France,9.8,"Red Fruit, Rose, Violet",per bottle,Red,13.0,2021
"Domaine de Villemajou Rosé 2022, Corbières",19.99,75.0,France,9.8,"Cream, Red Apple, Strawberry",per bottle,Rosé,13.0,2022
Aimé Arnoux Côtes du Rhône Blanc 2022,11.99,75.0,France,10.1,"Citrus Fruit, Floral, Stone Fruit, Mineral",per bottle,White,13.5,2022
"Viñalba 'Gran Reservado' Malbec 2019/20, Mendoza",18.99,75.0,Argentina,10.9,"Violet, Black Fruit, Red Fruit, Ripe Fruit, Vanilla",per bottle,Red,14.5,2019/20
"Errazuriz Max Reserva Cabernet 2019/21, Aconcagua Valley",14.99,75.0,Chile,10.5,"Black Plum, Blackcurrant, Vanilla",per bottle,Red,14.0,2021
"Yalumba Y Series Viognier 2021/22, Australia",10.99,75.0,Australia,10.1,"Stone Fruit, Apricot, Ginger, Grapefruit, Green Apple, Honey, Melon, Peach, Pear, Pineapple",per bottle,White,13.5,2022
"Château Coufran Cru Bourgeois Supérieur 2007, Haut-Médoc",21.99,75.0,France,9.8,"Cedar, Black Plum, Blackberry",per bottle,Red,13.0,2007
"Boekenhoutskloof ‘The Wolftrap’ Shiraz 2021, South Africa",9.99,75.0,South Africa,10.9,"Black Fruit, Black Pepper, Black Plum, Blackberry, Cranberry, Savoury, Spice",per bottle,Red,14.5,2021
"Chronic Cellars 'Purple Paradise' 2019/20, Paso Robles",17.99,75.0,USA,10.9,"Spice, Black Cherry, Blueberry, Chocolate",per bottle,Red,14.5,2020
"Bruce Jack Wines Reserve Collection ‘Stream of Consciousness’ 2021, Western Cape",11.99,75.0,South Africa,10.5,"Chocolate, Forest Floor, Red Plum, Spice, White Pepper",per bottle,Red,14.0,2021
Feudi di San Gregorio Greco di Tufo DOCG 2021/22,16.99,75.0,Italy,9.8,"Grapefruit, Honey, Lemon, Peach, Red Apple",per bottle,White,13.0,2022
Les Grandes Serres ‘Hommage du Rhône’ Châteauneuf-du-Pape 2022,25.99,75.0,France,10.9,"Black Pepper, Red Fruit, Spice",per bottle,Red,14.5,2022
Les Caveau du Prieuré Vinsobres 2020,13.99,75.0,France,11.3,"Red Fruit, Savoury, Spice",per bottle,Red,15.0,2020
Alain Jaume ‘Les Champauvins’ Organic Côtes Du Rhône 2020,17.99,75.0,France,11.3,"Black Fruit, Black Pepper, Blackcurrant, Red Cherry, Red Fruit, Spice",per bottle,Red,15.0,2020
"Errazuriz Single Vineyard Sauvignon Blanc 2021/22, Casablanca Valley",11.99,75.0,Chile,10.1,"Wet Stones, Citrus Fruit, Grass, Green Apple",per bottle,White,13.5,2022
Langlois-Chateau 'Classique' Crémant de Loire Brut Rosé,19.99,75.0,France,9.4,"Green Apple, Raspberry, Strawberry",per bottle,Rosé,12.5,Non-Vintage
