Title,Price,Capacity,Country,Unit,Characteristics,Quantity,Type,ABV,Vintage
"Two Hands Ares Shiraz 2017/18, Barossa Valley",89.99,75.0,Australia,10.9,"Black Fruit, Black Pepper, Black Plum, Blackberry, Blackcurrant, Blueberry, Chocolate, Sweet Spice, Tobacco, Vanilla",per bottle,Red,14.5,2018
"Two Hands 'Bella's Garden' Shiraz 2017/18, Barossa Valley",39.99,75.0,Australia,11.3,"Mint, Black Cherry, Black Plum, Blackberry, Blueberry, Earth, Leather, Liquorice",per bottle,Red,15.0,2018
"Two Hands 'Lily's Garden' Shiraz 2018/19, McLaren Vale",39.99,75.0,Australia,11.3,"Vanilla, Black Cherry, Black Plum, Blackcurrant, Blueberry, Chocolate, Coffee, Jammy, Sweet Spice",per bottle,Red,15.0,2019
"Vavasour 'Papa' Sauvignon Blanc 2020, Marlborough",19.99,75.0,New Zealand,10.1,"Tropical Fruit, Grass, Green Apple, Green Bell Pepper, Lemon",per bottle,White,13.5,2020
"Vavasour Sauvignon Blanc 2022, Marlborough",13.99,75.0,New Zealand,10.1,"Citrus Fruit, Elderflower, Gooseberry, Passionfruit",per bottle,White,13.5,2022
Monte Schiavo Organic Verdicchio dei Castelli di Jesi DOC 2022,9.99,75.0,Italy,9.4,"Lime, Almond, Apricot, Lemon",per bottle,White,12.5,2022
Veuve Clicquot 'La Grande Dame' 2012/15 Champagne,210.0,75.0,France,9.4,"Pear, Almond, Biscuit, Bread, Green Apple",per bottle,White,12.5,2012/2015
"VIK Milla Cala 2019/20, Cachapoal Valley",38.99,75.0,Chile,10.5,"Green Bell Pepper, Black Cherry, Black Plum, Blackcurrant, Cedar",per bottle,Red,14.0,2020
Vidal-Fleury Côtes du Rhône 2019/20,12.99,75.0,France,11.3,"Spice, Black Plum, Blackberry, Cedar, Earth, Raspberry",per bottle,Red,15.0,2020
"Villa Maria Cellar Selection Pinot Noir 2020/21, Marlborough",16.99,75.0,New Zealand,10.1,"Sweet Spice, Black Cherry, Blackberry, Red Fruit",per bottle,Red,13.5,2021
"Villa Vito Pinot Grigio 2021/22, Italy",7.99,75.0,Italy,9.0,"Lime, Floral, Lemon",per bottle,White,12.0,2022
"Villarei Albariño 2021/22, Rías Baixas",16.99,75.0,Spain,9.8,"Wet Stones, Apricot, Bread Dough, Lemon, Peach",per bottle,White,13.0,2022
"Viñalba ‘Cuvée Diane’ 2019/20, Mendoza",39.99,75.0,Argentina,11.3,"Violet, Black Fruit, Liquorice, Mint, Red Fruit, Ripe Fruit, Vanilla",per bottle,Red,15.0,2019
"Viñalba ‘Parrilla’ Malbec 2020/22, Mendoza",11.99,75.0,Argentina,10.9,"Violet, Black Fruit, Red Fruit, Ripe Fruit",per bottle,Red,14.5,2022
"Viñalba Selección Torrontés 2021/22, Lujan de Cuyo",11.99,75.0,Argentina,10.1,"Stone Fruit, Floral, Lychee, Peach, Pear",per bottle,White,13.5,2021/22
"Vino Nobile Di Montepuliciano 2017/18 Bonacchi, Italy",16.99,75.0,Italy,9.8,"Strawberry, Raspberry, Red Cherry",per bottle,Red,13.0,2018
Viré-Clessé Vieilles Vignes 2020/22 Christophe Cordier,22.99,75.0,France,10.5,"Peach, Apricot, Bread, Floral, Honey, Lemon",per bottle,White,14.0,2022
Voerzio Martini 'La Serra' Barolo DOCG 2017,39.99,75.0,Italy,10.9,"Cigar Box, Rose, Savoury, Strawberry",per bottle,Red,14.5,2017
"Waimea Estates Gewürztraminer 2021/22, Nelson",14.99,75.0,New Zealand,10.1,"Tropical Fruit, Citrus Fruit, Lychee, Orange",per bottle,White,13.5,2022
"Waimea Estates Grüner Veltliner 2021/22, Nelson",12.99,75.0,New Zealand,9.8,"White Pepper, Pineapple, Stone Fruit, Tropical Fruit",per bottle,White,13.0,2022
"Weingut Bründlmayer 'Langenloiser Alte Reben' Organic Grüner Veltliner 2021/22, Langenlois",39.99,75.0,Austria,10.9,"Vanilla, Almond, Citrus Fruit, Stone Fruit",per bottle,White,14.5,2021
"Winemaker Series The Red 2019/20, Swartland",11.99,75.0,South Africa,10.9,"Chocolate, Black Fruit, Black Pepper, Blackberry, Blackcurrant, Cedar",per bottle,Red,14.5,2020
"Winzer Krems Grüner Veltliner 2021/22, Austria",11.99,75.0,Austria,9.8,"White Pepper, Citrus Fruit, Peach",per bottle,White,13.0,2022
"Wolf Blass Yellow Label Chardonnay 2021/22, South Australia",9.99,75.0,Australia,10.1,"Vanilla, Butter, Green Apple, Lemon, Peach",per bottle,White,13.5,2022
"Wynns Coonawarra Estate 'Black Label' Cabernet Sauvignon 2017/18/19, Coonawarra",29.99,75.0,Australia,10.4,"Black Plum, Blackberry, Blackcurrant, Cigar Box, Mint, Spice",per bottle,Red,13.8,2019
"Yalumba Cigar Cabernet Sauvignon 2017/18, Coonawarra",28.99,75.0,Australia,10.9,"Tobacco, Black Plum, Blackberry, Blackcurrant, Chocolate, Cigar Box, Eucalyptus, Mint",per bottle,Red,14.5,2018
"Yalumba 'The Signature' Cabernet Sauvignon-Shiraz 2018/19, Barossa",41.99,75.0,Australia,10.9,"Vanilla, Black Cherry, Blackberry, Blackcurrant, Cedar, Cinnamon, Nutmeg, Smoke, Spice, Tobacco",per bottle,Red,14.5,2018
"Zuccardi 'Q' Malbec 2020/21, Mendoza",16.99,75.0,Argentina,10.9,"Violet, Black Fruit, Chocolate, Red Fruit, Ripe Fruit",per bottle,Red,14.5,2021
"Indomita 'Duette' Pinot Noir 2021/22, Casablanca Valley",14.99,75.0,Chile,10.5,"Vanilla, Earth, Red Cherry, Strawberry",per bottle,Red,14.0,2021/22
Definition Sauternes 2013/16,23.99,75.0,France,9.8,"Apricot, Citrus Fruit, Honey",per bottle,White,13.0,2016
"Waimea Estates Sauvignon Gris 2021/22, Nelson",12.99,75.0,New Zealand,10.5,"Tropical Fruit, Grapefruit, Honeysuckle, Passionfruit",per bottle,White,14.0,2022
"Casa Ferreirinha 'Planalto' White Reserva 2021/22, Douro",9.99,75.0,Portugal,9.8,"Pear, Apricot, Floral, Melon",per bottle,White,13.0,2022
Negrar Appassimento Rosso Veneto 2021/22,14.99,75.0,Italy,10.5,"Vanilla, Black Plum, Red Cherry",per bottle,Red,14.0,2022
Veuve Clicquot Brut Champagne,53.99,75.0,France,9.0,"Citrus Fruit, Biscuit, Bread",per bottle,White,12.0,Non-Vintage
L'Ouest de Lamothe Guignard Sauternes 2010 Half Bottle,14.99,37.5,France,5.1,-,per bottle,White,13.5,2010
Château Duhart Milon Pauillac 2011,135.0,75.0,France,9.4,-,per bottle,Red,12.5,2011
Bollinger 'Special Cuvée' Brut Champagne,59.99,75.0,France,9.0,"Green Apple, Biscuit, Bread, Citrus Fruit",per bottle,White,12.0,Non-Vintage
"Porta 6 2020/21, Lisbon",8.99,75.0,Portugal,10.1,"Sweet Spice, Jammy, Red Fruit",per bottle,Red,13.5,2021
"Marcelo Pelleriti Malbec 2020/21, Mendoza",12.99,75.0,Argentina,10.5,"Violet, Black Fruit, Red Fruit, Ripe Fruit",per bottle,Red,14.0,2021
Definition Provence Rosé 2021/22,11.99,75.0,France,9.8,"Strawberry, Herbaceous, Peach, Raspberry",per bottle,Rosé,13.0,2022
"Mirabeau 'Pure' Rosé 2021/22, Provence",18.99,75.0,France,9.8,"Strawberry, Herbaceous, Peach, Raspberry",per bottle,Rosé,13.0,2022
"Balfour '1503' Brut, Kent",25.99,75.0,England,9.0,"Green Apple, Bread, Citrus Fruit",per bottle,White,12.0,Non-Vintage
"Graham Beck Brut, South Africa",16.99,75.0,South Africa,9.0,"Cream, Bread, Citrus Fruit",per bottle,White,12.0,Non-Vintage
"Dog Point Organic Sauvignon Blanc 2022, Marlborough",22.99,75.0,New Zealand,10.1,"Tropical Fruit, Grass, Green Apple, Lemon",per bottle,White,13.5,2022
Laurent-Perrier 'Cuvée Rosé' Champagne,79.99,75.0,France,9.0,"Strawberry, Raspberry, Red Cherry",per bottle,Rosé,12.0,Non-Vintage
"Bolney Estate Pinot Gris 2019/20, Sussex",23.99,75.0,England,9.0,"Green Apple, Honey, Red Apple, Wet Stones",per bottle,White,12.0,2020
"Chapel Down 'A Touch of Sparkle' 2021/22, Kent",19.99,75.0,England,9.4,"Lime, Citrus Fruit, Floral",per bottle,White,12.5,2022
Pasqua 'Romeo & Juliet' Prosecco DOC Rosé 2021/22,13.99,75.0,Italy,8.3,"Citrus Fruit, Red Fruit, Stone Fruit",per bottle,Rosé,11.0,2022
"Chosen by Majestic Rosé 2022, Pays d’Oc",9.99,75.0,France,9.4,"Citrus Fruit, Peach, Red Fruit",per bottle,Rosé,12.5,2022
"Copper Kingdom Shiraz 2017, Barossa",14.99,75.0,Australia,10.9,"Leather, Black Pepper, Blackberry, Blackcurrant, Blueberry, Chocolate, Jammy",per bottle,Red,14.5,2017
"Chapel Down Rosé 2021/22, Kent",16.99,75.0,England,9.4,"Strawberry, Peach, Raspberry",per bottle,Rosé,12.5,2022
Domaine Michaut Frères 'Le Jardin du Curé' Chablis 2021/22,24.99,75.0,France,9.8,"Green Apple, Lemon, Wet Stones",per bottle,White,13.0,2022
"Mirabeau 'La Folie' Sparkling Rosé, Provence",17.99,75.0,France,9.4,"Strawberry, Citrus Fruit, Pineapple, Raspberry",per bottle,Rosé,12.5,Non-Vintage
"Penfolds Bin 8 Shiraz-Cabernet Sauvignon 2019, South Australia",29.99,75.0,Australia,10.9,"Black Plum, Blackcurrant, Chocolate, Strawberry, Vanilla, Cassis",per bottle,Red,14.5,2019
Cattier Brut Blanc de Blancs Premier Cru Champagne,49.99,75.0,France,9.4,"Apricot, Pastry, Peach",per bottle,White,12.5,Non-Vintage
S&R Douro DOC 2018/19,11.99,75.0,Portugal,10.5,"Violet, Black Fruit, Earth, Red Fruit, Spice, Vanilla",per bottle,Red,14.0,2019
Louis Latour Bourgogne Côte d'Or Blanc 2019/21,27.99,75.0,France,10.1,"Almond, Honey, Lemon",per bottle,White,13.5,2021/2022
"Leonidas Nassiakos ‘White Ash’ Assyrtiko 2020, Santorini",25.99,75.0,Greece,10.1,"Citrus Fruit, Lemon, Peach, Stone Fruit",per bottle,White,13.5,2020
Heidsieck & Co. Monopole 'Rose Top' Champagne,39.99,75.0,France,9.4,"Biscuit, Raspberry, Red Fruit",per bottle,Rosé,12.5,Non-Vintage
"Simpsons Wine Estate Rosé 2020/22, England",14.99,75.0,England,9.4,"Strawberry, Peach, Raspberry",per bottle,Rosé,12.5,2022
"Definition GSM 2020/21, South Australia",10.99,75.0,Australia,10.9,"Black Plum, Red Fruit, Spice",per bottle,Red,14.5,2021
"Rustenberg 'Wild Ferment' Sauvignon Blanc 2020/22, Stellenbosch",14.99,75.0,South Africa,10.1,"Gooseberry, Melon, Passionfruit, Peach, Pineapple",per bottle,White,13.5,2022
"Montes Single Vineyard Merlot 2020/21, Colchagua Valley",12.99,75.0,Chile,10.9,"Vanilla, Black Fruit, Red Fruit, Ripe Fruit",per bottle,Red,14.5,2021
"Dourthe Réserve Sauvignon Blanc 2021/22, Bordeaux",11.99,75.0,France,9.4,"Wet Stones, Citrus Fruit, Gooseberry, Herbaceous, Lemon",per bottle,White,12.5,2022
Araldica Moscato d'Asti 2021/22,10.99,75.0,Italy,3.8,"Lemon, Elderflower, Honey",per bottle,White,5.0,2022
"Catena Chardonnay 2020/21, Mendoza",14.99,75.0,Argentina,10.1,"Vanilla, Peach, Pineapple",per bottle,White,13.5,2021
"Montes Single Vineyard Chardonnay 2020/21, Casablanca Valley",12.99,75.0,Chile,10.9,"Vanilla, Lemon, Peach",per bottle,White,14.5,2021
"Quinta do Portal 'Mural' Reserva Tinto 2020, Douro",15.99,75.0,Portugal,10.5,"Black Cherry, Black Fruit, Floral, Vanilla",per bottle,Red,14.0,2020
"Incanta Chardonnay 2021, Romania",8.99,75.0,Romania,9.8,-,per bottle,White,13.0,2021
"Miraval Blanc 2022, Côtes de Provence",22.99,75.0,France,9.4,"Citrus Fruit, Floral, Green Apple",per bottle,White,12.5,2022
"The Whale Cove Sauvignon Blanc 2021/22, South Africa",8.99,75.0,South Africa,9.4,"Gooseberry, Grapefruit, Grass, Green Apple, Lemon, Tropical Fruit",per bottle,White,12.5,2022
"Cave Vinicole de Hunawihr ‘8’ Pinot Noir 2019, Alsace",16.99,75.0,France,10.5,"Ripe Fruit, Sour Cherry, Sweet Spice",per bottle,Red,14.0,2019
"Quinta do Portal ‘Muros de Vinha’ 2021, Douro",12.99,75.0,Portugal,9.8,"Floral, Red Fruit, Vanilla",per bottle,Red,13.0,2021
Pol Roger 'Réserve' Brut Champagne,56.99,75.0,France,9.4,"Pear, Bread, Citrus Fruit, Cream",per bottle,White,12.5,Non-Vintage
La Gioiosa Prosecco DOC Rosé 2021/22,12.99,75.0,Italy,7.9,"Strawberry, Citrus Fruit, Raspberry, Red Fruit",per bottle,Rosé,10.5,2022
"Yealands Sauvignon Blanc 2021/22, Marlborough",11.99,75.0,New Zealand,9.8,"Tropical Fruit, Grass, Green Apple, Green Bell Pepper, Lemon",per bottle,White,13.0,2022
Domaine Jomain Bourgogne Côte d’Or Blanc 2020/21,22.99,75.0,France,10.9,"Vanilla, Butter, Cream, Honey, Lemon, Peach",per bottle,White,14.5,2021
"3 Finger Jack Zinfandel 2019/20, Lodi",16.99,75.0,USA,11.3,"Black Cherry, Black Plum, Blackberry, Coffee, Raspberry, Spice",per bottle,Red,15.0,2020
"Domaine de Saint Ferréol Viognier 2021/22, Languedoc",16.99,75.0,France,10.1,"Pineapple, Apricot, Lychee, Mango",per bottle,White,13.5,2022
Moillard-Thomas Chablis Premier Cru 2022,29.99,75.0,France,9.8,"Citrus Fruit, Floral, Lemon",per bottle,White,13.0,2022
"Matias Riccitelli 'Hey Malbec!' 2021/22, Mendoza",13.99,75.0,Argentina,10.5,"Violet, Black Fruit, Black Pepper, Red Fruit, Ripe Fruit",per bottle,Red,14.0,2022
Cattier Premier Cru Brut Champagne,39.99,75.0,France,9.4,"Citrus Fruit, Pastry, Peach",per bottle,White,12.5,Non-Vintage
Maschio Conegliano Extra Dry Prosecco Superiore DOCG,13.99,75.0,Italy,8.3,"Floral, Green Apple, Honey",per bottle,White,11.0,Non-Vintage
"Chateau Ste. Michelle Cabernet Sauvignon 2018/19, Columbia Valley",16.99,75.0,USA,10.5,"Vanilla, Black Plum, Blackberry, Blackcurrant, Cedar",per bottle,Red,14.0,2019
Rémy Ferbras Côtes du Rhône Villages 2021,11.99,75.0,France,10.5,"Black Pepper, Blackberry, Red Fruit",per bottle,Red,14.0,2021
"Vilarnau ‘Gaudi’ Organic Rosé Cava Brut Reserva, Penedès",13.99,750.0,Spain,9.0,"Bread, Pastry, Raspberry, Red Apple, Strawberry",per bottle,White,12.0,Non-Vintage
"Chapel Down Flint Dry 2021/22, Kent",17.99,75.0,England,9.4,"Wet Stones, Citrus Fruit, Elderflower",per bottle,White,12.5,2022
Domaine Trouillet Pouilly-Fuissé 2020/21,29.99,75.0,France,10.1,"Vanilla, Apricot, Butter, Cream, Floral, Honey, Lemon, Peach",per bottle,White,13.5,2021
Château de Pizay Brouilly 2021/22,15.99,75.0,France,9.8,"Prune, Raspberry, Red Fruit, Strawberry",per bottle,Red,13.0,2022
Cave de Tain 'Les Blasons' Crozes-Hermitage 2019/20,16.99,75.0,France,10.1,"Spice, Black Cherry, Black Plum, Blackberry",per bottle,Red,13.5,2020
"Yealands Estate Single Vineyard Sauvignon Blanc 2022, Marlborough",14.99,75.0,New Zealand,9.8,"Grass, Green Apple, Lemon, Stone Fruit, Tropical Fruit",per bottle,White,13.0,2022
Victorine de Chastenay Brut Crémant de Bourgogne,19.99,75.0,France,9.4,"Honey, Citrus Fruit, Green Apple",per bottle,White,12.5,Non-Vintage
"Definition Bacchus 2021/22, England",16.99,75.0,England,9.4,"Apricot, Elderflower, Peach",per bottle,White,12.5,2022
"Domaine Begude 'Le Paradis' Organic Viognier 2021/22, Limoux",16.99,75.0,France,10.1,"Spice, Apricot, Peach",per bottle,White,13.5,2022
"Cline 'Nancy's Vines' Viognier 2020/21, California",17.99,75.0,USA,10.9,"Vanilla, Peach, Pear, Pineapple, Stone Fruit",per bottle,White,14.5,2021
"Cune Cava Brut, Penedès",16.99,750.0,Spain,8.6,"Lemon, Red Apple, Stone Fruit",per bottle,White,11.5,Non-Vintage
Definition Sauternes 2014 Half Bottle,11.99,37.5,France,4.9,"Apricot, Honey, Lemon, Orange, Orange Marmalade, Citrus Fruit",per bottle,White,13.0,2014
"Louis M. Martini Cabernet Sauvignon 2017/18, Sonoma County",21.99,75.0,USA,10.9,"Blackcurrant, Vanilla, Black Cherry",per bottle,Red,14.5,2018
"Balfour '1503' Rosé, Kent",25.99,75.0,England,9.0,"Strawberry, Biscuit, Citrus Fruit, Raspberry",per bottle,Rosé,12.0,Non-Vintage
"Louis Pommery Brut England, Hampshire",34.99,75.0,England,9.4,"Peach, Bread, Citrus Fruit, Green Apple",per bottle,White,12.5,Non-Vintage
"Definition English Sparkling Rosé, Hampshire",29.99,75.0,England,9.0,"Cream, Raspberry, Red Fruit",per bottle,Rosé,12.0,Non-Vintage
"Balfour Brut Rosé 2017, Kent",39.99,75.0,England,9.0,"Herbaceous, Red Fruit, Strawberry",per bottle,Rosé,12.0,2017
"La Brise Blanche Organic Albariño 2022, France",11.99,75.0,France,9.8,"Apricot, Green Apple, Peach",per bottle,White,13.0,2022
"Amiral de Beychevelle 2020, Saint-Julien",39.99,75.0,France,10.1,"Red Fruit, Savoury, Spice",per bottle,Red,13.5,2020
Raoul Clerget Beaujolais,9.99,75.0,France,9.8,"Raspberry, Red Cherry",per bottle,Red,13.0,Non-Vintage
"LB7 Rosé 2021/22, Lisbon",9.49,75.0,Portugal,9.4,"Strawberry, Floral, Peach, Raspberry",per bottle,Rosé,12.5,2021
"Château Pigoudet 'La Chapelle' Rosé 2021/22, Coteaux d'Aix-en-Provence",13.99,75.0,France,10.1,"Strawberry, Herbaceous, Peach, Raspberry",per bottle,Rosé,13.5,2022
"Miraval ‘Sainte Victoire’ Rosé 2022, Côtes-de-Provence Sainte-Victoire",26.99,75.0,France,9.8,"Cranberry, Raspberry, Mineral",per bottle,Rosé,13.0,2022
"Floração Rosé 2021/22, Lisbon",7.99,75.0,Portugal,9.4,"Strawberry, Peach, Raspberry",per bottle,Rosé,12.5,2022
"Famille Bougrier 'Les Roches Blanches' Sauvignon Blanc 2021/22, Touraine",13.99,75.0,France,9.4,"Citrus Fruit, Green Apple, Peach",per bottle,White,12.5,2022
"Nero Oro Rosé 2021, Sicily",11.99,75.0,Italy,9.4,"Floral, Red Cherry, Strawberry",per bottle,Rosé,12.5,2021
"Caves d'Esclans 'Whispering Angel' Rosé 2021/22 Magnum, Provence",47.99,150.0,France,19.5,"Herbaceous, Peach, Raspberry, Strawberry",per bottle,Rosé,13.0,2022
"Maison Saint Aix 'AIX' Rosé Double Magnum 2021/22, Coteaux d'Aix en Provence",83.99,300.0,France,39.0,"Herbaceous, Peach, Raspberry, Strawberry",per bottle,Rosé,13.0,2022
"Compagnia Rosé 2022, Île de Beauté, Corsica",12.99,75.0,France,9.0,"Cranberry, Peach, Raspberry",per bottle,Rosé,12.0,2022
"Gérard Bertrand 'Côte des Roses' Rosé Magnum 2022, Languedoc",26.99,1.5,France,19.5,"Floral, Grapefruit, Peach, Raspberry, Strawberry",per bottle,Rosé,13.0,2022
"Alamos Malbec Rosé 2021/22, Mendoza",9.99,75.0,Argentina,10.1,"Strawberry, Peach, Raspberry",per bottle,Rosé,13.5,2022
"Silver Ghost Rosé 2021/22, South Africa",6.99,75.0,South Africa,9.0,"Strawberry, Peach, Raspberry",per bottle,Rosé,12.0,2022
"Cloudy Bay 'Pelorus' Sparkling Rosé, Marlborough",32.99,75.0,New Zealand,9.4,"Strawberry, Raspberry, Red Fruit",per bottle,Rosé,12.5,Non-Vintage
"Barefoot White Zinfandel Rosé, California",7.99,75.0,USA,6.0,"Watermelon, Red Cherry, Strawberry",per bottle,Rosé,8.0,Non-Vintage
"Majestic Fizzy & Juicy, Italy",6.99,75.0,Italy,8.3,"Raspberry, Red Apple, Strawberry",per bottle,Rosé,11.0,Non-Vintage
"Bottega ‘Rose Gold’ Brut Rosé, Lombardy",25.99,75.0,Italy,8.6,"Citrus Fruit, Honey, Raspberry, Red Apple, Strawberry",per bottle,Rosé,11.5,Non-Vintage
Nicolas Feuillatte Brut Champagne,29.99,75.0,France,9.0,"Green Apple, Biscuit, Bread, Citrus Fruit",per bottle,White,12.0,Non-Vintage
Cune Rioja Reserva 2018/19,14.99,75.0,Spain,10.5,"Vanilla, Black Fruit, Red Fruit",per bottle,Red,14.0,2018
"Château Tour de Bigorre 2016, Bordeaux",11.99,75.0,France,10.1,"Red Fruit, Savoury, Vanilla, Toast",per bottle,Red,13.5,2016
"Journey’s End ‘Lone Creek’ Sauvignon Blanc 2021/22, Western Cape",9.99,75.0,South Africa,9.4,"Elderflower, Lemon, Passionfruit",per bottle,White,12.5,2022
LB7 Vinho Verde DOC 2021/22,8.99,75.0,Portugal,7.5,"Pear, Citrus Fruit, Green Apple",per bottle,White,10.0,2022
"Cloudy Bay 'Pelorus' Brut, Marlborough",31.99,75.0,New Zealand,9.4,"Green Apple, Citrus Fruit, Cream",per bottle,White,12.5,Non-Vintage
"Fincher & Co. Sauvignon Blanc 2021/22, Awatere Valley",14.99,75.0,New Zealand,10.1,"Tropical Fruit, Grass, Green Apple, Green Bell Pepper, Lemon",per bottle,White,13.5,2022
"Springfield Estate Albariño 2022, Robertson",16.99,75.0,South Africa,9.8,"Citrus Fruit, Peach, Stone Fruit, Wet Stones",per bottle,White,13.0,2022
"Morgadio Da Torre Alvarinho 2019, Vinho Verde",15.99,75.0,Portugal,9.8,"Citrus Fruit, Green Apple, Peach, Spice",per bottle,White,13.0,2019
Definition Hautes-Côtes de Nuits 2017,19.99,75.0,France,9.4,"Dried Herbs, Red Cherry, Savoury, Strawberry",per bottle,Red,12.5,2017
"Villiera Barrel Fermented Chenin Blanc 2022, Stellenbosch",14.99,75.0,South Africa,10.9,"Bread, Green Apple, Stone Fruit, Vanilla",per bottle,White,14.5,2022
"Gabb Family Vineyards Cabernet Sauvignon 2020/21, South Africa",14.99,75.0,South Africa,10.9,"Spice, Black Plum, Blackcurrant",per bottle,Red,14.5,2021
"Mayu Gran Reserva Chardonnay 2020, Elqui Valley",13.99,75.0,Chile,10.1,"Banana, Pineapple, Stone Fruit, Tropical Fruit",per bottle,White,13.5,2020
VIVIR Tequila Blanco,33.0,70.0,Mexico,28.0,-,per bottle,White,40.0,Non-Vintage
Moillard-Thomas Chablis 2021/22,19.99,75.0,France,9.4,"Blossom, Citrus Fruit, Lemon",per bottle,White,12.5,2022
"Devil's Creek 'Gold Reserve' Sauvignon Blanc 2022, Marlborough",12.99,75.0,New Zealand,9.4,"Tropical Fruit, Gooseberry, Grass, Green Apple, Lemon",per bottle,White,12.5,2022
Domaine Claude Lafond ‘Cuvée Nathalie’ Reuilly Blanc 2021/22,14.99,75.0,France,10.1,"Citrus Fruit, Gooseberry, Green Apple, Peach",per bottle,White,13.5,2021
"Thierry Delaunay 'Le Manoir' Rosé 2020/21, Touraine",11.99,75.0,France,10.1,"Wet Stones, Floral, Peach, Raspberry, Strawberry",per bottle,Rosé,13.5,2021
"Lyme Bay Chardonnay 2020/21, Essex",26.99,75.0,England,10.1,"Green Apple, Lemon, Peach, Vanilla",per bottle,White,13.5,2021
Definition Sancerre 2020/21,19.99,75.0,France,10.1,"Green Apple, Citrus Fruit, Grass",per bottle,White,13.5,2021
"Domaine Skouras Assyrtiko 2021/22, Nemea",15.99,75.0,Greece,10.1,"Wet Stones, Green Apple, Lemon, Nectarine",per bottle,White,13.5,2022
Didier Montchevot Organic Beaune Premier Cru 2018,45.99,75.0,France,9.8,-,per bottle,Red,13.0,2018
Domaine Cordier Père et Fils 'En Faux' Saint-Véran 2020/22,19.99,75.0,France,10.1,"Citrus Fruit, Melon, Peach",per bottle,White,13.5,2022
Domaine Cordier Père et Fils 'Vieilles Vignes' Pouilly-Fuissé 2020/21,34.99,75.0,France,10.1,"Apricot, Passionfruit, Peach, Spice",per bottle,White,13.5,2021
Domaine Roux Père & Fils ‘Les Agnières’ Rully Blanc 2020,34.99,75.0,France,9.8,-,per bottle,White,13.0,2020
Famille Brocard Chablis Premier Cru Vau de Vey 2021,29.99,75.0,France,9.4,"Grass, Lemon, Spice",per bottle,White,12.5,2021
Henri Pion Gevrey-Chambertin 2018,56.99,75.0,France,10.1,-,per bottle,Red,13.5,2018
Nicolas Feuillatte 'Grande Réserve' Brut Champagne Magnum,63.99,150.0,France,18.0,-,per bottle,White,12.0,Non-Vintage
Olarra Clásico Rioja Reserva 2018,14.99,75.0,Spain,10.1,-,per bottle,Red,13.5,2018
Pagos del Rey ‘409’ Ribera del Duero 2020/21,14.99,75.0,Spain,10.5,"Black Plum, Blackcurrant, Cedar, Sweet Spice",per bottle,Red,14.0,2021
"Tbilvino Saperavi 2021, Georgia",13.99,75.0,Georgia,9.8,"Black Cherry, Black Fruit, Blackberry, Sweet Spice",per bottle,Red,13.0,2021
"Falua Tercius Tinto 2021, Tejo",9.99,75.0,Portugal,9.8,"Cranberry, Red Cherry, Red Fruit, Violet",per bottle,Red,13.0,2021
Chateau de Targé 'Les Cerisiers de Targe' Organic Saumur-Champigny 2020,14.99,75.0,France,9.8,"Blackcurrant, Red Fruit, Violet, White Pepper",per bottle,Red,13.0,2020
Rhonea 'Notre Dame des Vignes' Visan 2020,12.99,75.0,France,10.5,"Black Pepper, Blackberry, Blueberry, Violet",per bottle,Red,14.0,2020
Château Grand Jean Bordeaux Blanc 2021,12.99,75.0,France,9.0,"Citrus Fruit, Gooseberry, Grapefruit, Green Apple",per bottle,White,12.0,2021
Bodegas Ontañón 'Canderuela' Rioja Crianza 2019,11.99,75.0,Spain,10.5,"Black Cherry, Black Plum, Coconut, Sweet Spice",per bottle,Red,14.0,2019
"Château Purcari 'Nocturne' Rara Neagra de Purcari 2021, Moldova",16.99,75.0,Moldova,10.1,"Black Fruit, Cocoa, Sweet Spice",per bottle,Red,13.5,2021
"Bostavan Winery  47°N Chardonnay 2021, Moldova",9.99,75.0,Moldova,9.8,"Citrus Fruit, Red Apple, Stone Fruit, Tropical Fruit",per bottle,White,13.0,2021
Cantina del Garda Valpolicella Ripasso DOC 2019,15.99,75.0,Italy,10.1,"Black Cherry, Black Pepper, Sweet Spice",per bottle,Red,13.5,2019
Baron Edmond de Rothschild Montagne-Saint-Émilion 2016/18,28.99,75.0,France,10.5,"Tobacco, Black Cherry, Black Plum, Cedar, Chocolate, Sweet Spice",per bottle,Red,14.0,2018
Ruinart Blanc de Blancs Champagne,88.99,75.0,France,9.4,"Hazelnut, Almond, Biscuit, Bread, Citrus Fruit",per bottle,White,12.5,Non-Vintage
Aqualta Prosecco DOC,9.99,75.0,Italy,8.3,"Green Apple, Citrus Fruit, Floral",per bottle,White,11.0,Non-Vintage
Veuve Clicquot Rosé Champagne,59.99,75.0,France,9.4,"Strawberry, Raspberry, Red Cherry",per bottle,Rosé,12.5,Non-Vintage
"Mud House Pinot Noir 2020/21, Central Otago",13.99,75.0,New Zealand,10.1,"Sweet Spice, Black Cherry, Blackberry, Red Fruit",per bottle,Red,13.5,2021
Domaine Fouassier 'Sur le Fort' Organic Sancerre 2021/22,26.99,75.0,France,10.9,"Green Apple, Citrus Fruit, Cream, Grass",per bottle,White,14.5,2022
Ayala 'Brut Majeur' Extra Age Champagne,49.99,75.0,France,9.0,"Green Apple, Bread, Citrus Fruit",per bottle,White,12.0,Non-Vintage
"Château Batailley 'Lions de Batailley' 2015/16, Pauillac",39.99,75.0,France,10.1,-,per bottle,Red,13.5,2016
"Catena Zapata 'Catena Alta' Malbec 2019/20, Mendoza",33.99,75.0,Argentina,10.5,"Violet, Black Fruit, Chocolate, Red Fruit, Ripe Fruit, Vanilla",per bottle,Red,14.0,2020
Bollinger Rosé Champagne,62.99,75.0,France,9.0,"Strawberry, Raspberry, Red Cherry",per bottle,Rosé,12.0,Non-Vintage
Louis Roederer 'Collection 242' Brut Champagne,61.99,75.0,France,9.0,"Biscuit, Bread, Citrus Fruit",per bottle,White,12.0,Non-Vintage
Piper-Heidsieck 2012 Champagne,59.99,75.0,France,9.0,"Almond, Citrus Fruit, Honey",per bottle,White,12.0,2012
"Vallformosa Fest Brut Organic Cava, Penedes",13.99,75.0,Spain,8.6,"Apricot, Bread, Cream, Green Apple, Melon, Pear",per bottle,White,11.5,Non-Vintage
"Rupert & Rothschild 'Baroness Nadine' Chardonnay 2021/22, South Africa",25.99,75.0,South Africa,10.5,"Butter, Green Apple, Lemon, Peach, Smoke, Vanilla",per bottle,White,14.0,2022
Bottega 'Gold' Prosecco DOC,25.99,75.0,Italy,8.3,"Blossom, Citrus Fruit, Green Apple",per bottle,White,11.0,Non-Vintage
Nicolas Feuillatte Champagne Half Bottle,18.99,37.5,France,4.5,"Green Apple, Biscuit, Bread, Citrus Fruit",per bottle,White,12.0,Non-Vintage
"Bouvet Ladubay 'Saphir' Saumur Brut 2018/19, Magnum",32.99,1.5,France,18.8,"Hazelnut, Honey, Peach",per bottle,White,12.5,2019
Cantina Chiara Ziliani 'Duca Diseo' Franciacorta DOCG Brut,22.99,75.0,Italy,9.4,"Bread, Peach, Pear",per bottle,White,12.5,Non-Vintage
Ruinart 'Second Skin' Brut Rosé Champagne,94.99,75.0,France,9.4,"Lychee, Raspberry, Strawberry",per bottle,Rosé,12.5,Non-Vintage
"Vallformosa Fest Brut Rosé Cava, Penedes",13.99,75.0,Spain,9.0,"Cream, Pear, Raspberry, Red Apple, Red Cherry, Strawberry",per bottle,Rosé,12.0,Non-Vintage
Ruinart Rosé Champagne,88.99,75.0,France,9.4,"Strawberry, Mint, Raspberry, Red Cherry",per bottle,Rosé,12.5,Non-Vintage
Veuve Amiot ‘Elisa’ Crémant de Loire,13.99,75.0,France,9.0,"Almond, Biscuit, Stone Fruit",per bottle,White,12.0,Non-Vintage
Drappier 'Signature' Blanc de Blancs Brut Champagne,43.99,75.0,France,9.0,"Pear, Citrus Fruit, Green Apple, Honey",per bottle,White,12.0,Non-Vintage
